[
  {
    "videoId": "4C5nDxbAtOQ",
    "title": "Прославлення Господа 18.01.2026",
    "duration": 1799,
    "year": 2026,
    "formattedDate": "18 січня 2026 року",
    "rawDate": "2026-01-18T19:47:27.000Z"
  },
  {
    "videoId": "Fmmx0Ws0HlA",
    "title": "\"Воля Божа\" (Числа 22:1-6). Артем Бакаєв, 18.01.2026",
    "duration": 2246,
    "year": 2026,
    "formattedDate": "18 січня 2026 року",
    "rawDate": "2026-01-18T19:18:42.000Z"
  },
  {
    "videoId": "lA9OOpKy_vs",
    "title": "\"Природа неверия\" ( Ев.Иоанна 9). Сергей Комисар, 18.01.2026",
    "duration": 2594,
    "year": 2026,
    "formattedDate": "18 січня 2026 року",
    "rawDate": "2026-01-18T18:59:47.000Z"
  },
  {
    "videoId": "A1V7fjhE6kg",
    "title": "Богослужіння 18.01.2026",
    "duration": 7424,
    "year": 2026,
    "formattedDate": "18 січня 2026 року",
    "rawDate": "2026-01-18T18:37:30.000Z"
  },
  {
    "videoId": "ONcNsDwlxu8",
    "title": "\"Боротьба за місце під серцем\" (Буття 4:1-16). Андрій Парфило, 11.01.2026",
    "duration": 2641,
    "year": 2026,
    "formattedDate": "12 січня 2026 року",
    "rawDate": "2026-01-12T07:33:56.000Z"
  },
  {
    "videoId": "uCfS6l75jM4",
    "title": "Прославлення Господа 11.01.2026",
    "duration": 1523,
    "year": 2026,
    "formattedDate": "12 січня 2026 року",
    "rawDate": "2026-01-12T07:18:21.000Z"
  },
  {
    "videoId": "NIPQis4pLng",
    "title": "\"Три причини для подяки\" (Кол. 1:12-13). Олександр Іванченко, 11.01.2026",
    "duration": 1920,
    "year": 2026,
    "formattedDate": "12 січня 2026 року",
    "rawDate": "2026-01-12T06:06:03.000Z"
  },
  {
    "videoId": "ek5-H8amTEw",
    "title": "Богослужіння 11.01.2026",
    "duration": 6925,
    "year": 2026,
    "formattedDate": "11 січня 2026 року",
    "rawDate": "2026-01-11T21:02:09.000Z"
  },
  {
    "videoId": "QUsMmRthXzw",
    "title": "Прославлення Господа 04.01.2026",
    "duration": 1447,
    "year": 2026,
    "formattedDate": "05 січня 2026 року",
    "rawDate": "2026-01-05T08:28:59.000Z"
  },
  {
    "videoId": "lZwhUIYZMXE",
    "title": "\"Гнів Божий\" (1 Солунян 5:9). Микола Марйоха, 04.01.2026",
    "duration": 1387,
    "year": 2026,
    "formattedDate": "05 січня 2026 року",
    "rawDate": "2026-01-05T08:03:25.000Z"
  },
  {
    "videoId": "vZI7-dguteE",
    "title": "\"Царство Божье и сила слова\" (Луки 13:18-21). Сергей Комисар, 04.01.2026",
    "duration": 2482,
    "year": 2026,
    "formattedDate": "05 січня 2026 року",
    "rawDate": "2026-01-05T07:48:40.000Z"
  },
  {
    "videoId": "oj7ygJtsY0c",
    "title": "Богослужіння 04.01.2026",
    "duration": 7172,
    "year": 2026,
    "formattedDate": "04 січня 2026 року",
    "rawDate": "2026-01-04T19:44:57.000Z"
  },
  {
    "videoId": "mKy6YljcgBI",
    "title": "Прославлення Господа 01.01.2026",
    "duration": 1693,
    "year": 2026,
    "formattedDate": "02 січня 2026 року",
    "rawDate": "2026-01-01T23:34:52.000Z"
  },
  {
    "videoId": "bfOF9U_wPJY",
    "title": "\"Молитва за бачення у служінні церкви\" (Дії 2:42). Микола Марйоха, 01.01.2026",
    "duration": 1318,
    "year": 2026,
    "formattedDate": "02 січня 2026 року",
    "rawDate": "2026-01-01T22:39:34.000Z"
  },
  {
    "videoId": "9NEZ9lLOmug",
    "title": "\"Господи, навчи нас молитися\" (Луки 11:1-4). Віктор Лаба, 01.01.2026",
    "duration": 1539,
    "year": 2026,
    "formattedDate": "01 січня 2026 року",
    "rawDate": "2026-01-01T21:35:37.000Z"
  },
  {
    "videoId": "HBcen88ktXw",
    "title": "Богослужіння 01.01.2026",
    "duration": 4775,
    "year": 2026,
    "formattedDate": "01 січня 2026 року",
    "rawDate": "2026-01-01T21:20:41.000Z"
  },
  {
    "videoId": "amGxGSrYjys",
    "title": "Боже, дякуємо Тобі за прожитий 2025 рік!",
    "duration": 539,
    "year": 2025,
    "formattedDate": "31 грудня 2025 року",
    "rawDate": "2025-12-31T10:38:58.000Z"
  },
  {
    "videoId": "UcbgyfVf1QI",
    "title": "Прославлення Господа церквами ЄХБ м.Суми 28.12.2025",
    "duration": 3039,
    "year": 2025,
    "formattedDate": "29 грудня 2025 року",
    "rawDate": "2025-12-29T17:06:34.000Z"
  },
  {
    "videoId": "kY3n1WO3of8",
    "title": "\"Потіха Різдва для нас сьогодні\" (Євреям 2:14-15; Луки 2:1-20). Михайло Пімоненко, 28.12.2025",
    "duration": 1503,
    "year": 2025,
    "formattedDate": "29 грудня 2025 року",
    "rawDate": "2025-12-29T08:28:22.000Z"
  },
  {
    "videoId": "ZKBH1o0EHW0",
    "title": "\"Дивовижний Бог\" (Луки 2:15-18). Микола Марйоха, 28.12.2025",
    "duration": 709,
    "year": 2025,
    "formattedDate": "29 грудня 2025 року",
    "rawDate": "2025-12-29T08:12:40.000Z"
  },
  {
    "videoId": "F2DeolAH5dY",
    "title": "\"Мир Божий\" (Луки 2:1-14). Андрій Петреску, 28.12.2025",
    "duration": 829,
    "year": 2025,
    "formattedDate": "29 грудня 2025 року",
    "rawDate": "2025-12-29T08:08:04.000Z"
  },
  {
    "videoId": "FSN8I4GmtbQ",
    "title": "Богослужіння спільне з церквами ЄХБ м.Суми, 28.12.2025",
    "duration": 7033,
    "year": 2025,
    "formattedDate": "29 грудня 2025 року",
    "rawDate": "2025-12-29T07:22:27.000Z"
  },
  {
    "videoId": "m1VnEZyRGLo",
    "title": "Прославлення Господа 28.12.2025",
    "duration": 1056,
    "year": 2025,
    "formattedDate": "28 грудня 2025 року",
    "rawDate": "2025-12-28T21:46:32.000Z"
  },
  {
    "videoId": "yTIHOZUfV_Q",
    "title": "Богослужіння 28.12.2025",
    "duration": 6983,
    "year": 2025,
    "formattedDate": "28 грудня 2025 року",
    "rawDate": "2025-12-28T21:38:26.000Z"
  },
  {
    "videoId": "lOA90w6wisA",
    "title": "\"Судовий процес над поклонниками\" (Псалом 50). Андрій Парфило, 28.13.2025",
    "duration": 2783,
    "year": 2025,
    "formattedDate": "28 грудня 2025 року",
    "rawDate": "2025-12-28T16:53:28.000Z"
  },
  {
    "videoId": "n9hmefbTInc",
    "title": "\"Три принципи, необхідні для достойного християнина\" (Колосян 1:9-11). Олександр Іванченко, 28.12.25",
    "duration": 2050,
    "year": 2025,
    "formattedDate": "28 грудня 2025 року",
    "rawDate": "2025-12-28T16:15:45.000Z"
  },
  {
    "videoId": "S7nbRaS1pOg",
    "title": "Різдвяне дитяче служіння (Історія Різдва, ігри, вистава) 27.12.2025",
    "duration": 5677,
    "year": 2025,
    "formattedDate": "28 грудня 2025 року",
    "rawDate": "2025-12-28T07:13:57.000Z"
  },
  {
    "videoId": "f9f57bQyFUw",
    "title": "Вистава \"Різдвяні черевички для Бога\"",
    "duration": 1917,
    "year": 2025,
    "formattedDate": "28 грудня 2025 року",
    "rawDate": "2025-12-27T23:19:03.000Z"
  },
  {
    "videoId": "WZguwzFc7vs",
    "title": "Прославлення Господа 25.12.2025",
    "duration": 2059,
    "year": 2025,
    "formattedDate": "27 грудня 2025 року",
    "rawDate": "2025-12-27T09:14:02.000Z"
  },
  {
    "videoId": "ZKwAg4f1mp0",
    "title": "\"Прийдіть поклонитися Царю!\" (Матвія 2:1-12). Микола Марйоха, 25.12.2025",
    "duration": 944,
    "year": 2025,
    "formattedDate": "27 грудня 2025 року",
    "rawDate": "2025-12-27T09:00:05.000Z"
  },
  {
    "videoId": "HPLvmPFNWx8",
    "title": "\"Блекаут закінчиться на Різдво\" (Євангелія від Івана 1:5). Віталій Зінченко, 25.12.2025",
    "duration": 1739,
    "year": 2025,
    "formattedDate": "27 грудня 2025 року",
    "rawDate": "2025-12-27T07:44:46.000Z"
  },
  {
    "videoId": "97sJIfDduBA",
    "title": "Різдвяне Богослужіння 25.12.2025, вечір",
    "duration": 5232,
    "year": 2025,
    "formattedDate": "27 грудня 2025 року",
    "rawDate": "2025-12-27T06:21:39.000Z"
  },
  {
    "videoId": "CBP_o1bCjVo",
    "title": "\"Великий Бог\" (Луки 2:8-15). Віктор Лев, 25.12.2025",
    "duration": 1829,
    "year": 2025,
    "formattedDate": "26 грудня 2025 року",
    "rawDate": "2025-12-26T18:57:31.000Z"
  },
  {
    "videoId": "lVor6nAzYlc",
    "title": "\"Рождество Исуса Христа\" (Луки 2:8-14). Сергей Савченко, 25.12.2025",
    "duration": 1200,
    "year": 2025,
    "formattedDate": "26 грудня 2025 року",
    "rawDate": "2025-12-26T17:16:59.000Z"
  },
  {
    "videoId": "mXgvEa1MzFU",
    "title": "Прославлення Господа 25.12.2025, ранок",
    "duration": 1077,
    "year": 2025,
    "formattedDate": "26 грудня 2025 року",
    "rawDate": "2025-12-26T16:04:57.000Z"
  },
  {
    "videoId": "P_CVY8lr2O4",
    "title": "Різдвяне Богослужіння 25.12.2025, ранок",
    "duration": 4580,
    "year": 2025,
    "formattedDate": "26 грудня 2025 року",
    "rawDate": "2025-12-26T15:26:46.000Z"
  },
  {
    "videoId": "sMF5ZFCeik4",
    "title": "\"Життєві турботи\" (Матв. 6:25-34). Микола Марйоха, 21.12.2025",
    "duration": 1364,
    "year": 2025,
    "formattedDate": "22 грудня 2025 року",
    "rawDate": "2025-12-21T22:06:27.000Z"
  },
  {
    "videoId": "UEC5uhUChA0",
    "title": "\"Місія Царя - Агнець і Первосвященик\" (Євр. 10:5-14). Віталій Зінченко, 21.12.2025",
    "duration": 1613,
    "year": 2025,
    "formattedDate": "21 грудня 2025 року",
    "rawDate": "2025-12-21T21:48:09.000Z"
  },
  {
    "videoId": "hPbZrYZ1ixg",
    "title": "Прославлення Господа 21.12.2025",
    "duration": 1571,
    "year": 2025,
    "formattedDate": "21 грудня 2025 року",
    "rawDate": "2025-12-21T21:15:45.000Z"
  },
  {
    "videoId": "QqdedTnlLTI",
    "title": "АДВЕНТ (четвертий тиждень). Богослужіння 21.12.2025",
    "duration": 6192,
    "year": 2025,
    "formattedDate": "21 грудня 2025 року",
    "rawDate": "2025-12-21T19:44:56.000Z"
  },
  {
    "videoId": "Qi97WMW6Ai8",
    "title": "Жіноча конференція \" Спасешся ти і дім твій\". ІV частина. Підсумкова сесія: Q&A. (13.12.2025)",
    "duration": 3513,
    "year": 2025,
    "formattedDate": "15 грудня 2025 року",
    "rawDate": "2025-12-15T19:10:26.000Z"
  },
  {
    "videoId": "vY_J1zXCYcY",
    "title": "Жіноча конференція \"Спасешся ти і дім твій\". ІІІ частина (13.12.2025)",
    "duration": 3097,
    "year": 2025,
    "formattedDate": "15 грудня 2025 року",
    "rawDate": "2025-12-15T17:27:08.000Z"
  },
  {
    "videoId": "BaI2VQu7KW0",
    "title": "Жіноча конференція \"Спасешся ти і дім твій\". ІІ частина (13.12.2025)",
    "duration": 4174,
    "year": 2025,
    "formattedDate": "15 грудня 2025 року",
    "rawDate": "2025-12-15T11:39:44.000Z"
  },
  {
    "videoId": "7vn0veLroDA",
    "title": "Жіноча конференція \" Спасешся ти і твій дім\". І частина. 13.12.2025",
    "duration": 4352,
    "year": 2025,
    "formattedDate": "15 грудня 2025 року",
    "rawDate": "2025-12-15T06:08:17.000Z"
  },
  {
    "videoId": "El_YufGQ2WE",
    "title": "Прославлення Господа 14 грудня 2025 року",
    "duration": 1510,
    "year": 2025,
    "formattedDate": "14 грудня 2025 року",
    "rawDate": "2025-12-14T20:41:10.000Z"
  },
  {
    "videoId": "Ifudkl8OqYk",
    "title": "\"Документ підтверджуючий легітимність Царя\" (Мф. 1:1-17; Лк. 3:23-28). Андрій Парфило, 14.12.2025",
    "duration": 2097,
    "year": 2025,
    "formattedDate": "14 грудня 2025 року",
    "rawDate": "2025-12-14T20:16:47.000Z"
  },
  {
    "videoId": "Ffuh7fb0QOk",
    "title": "АДВЕНТ (третій тиждень). Богослужіння 14 грудня 2025 року",
    "duration": 5620,
    "year": 2025,
    "formattedDate": "14 грудня 2025 року",
    "rawDate": "2025-12-14T19:31:36.000Z"
  },
  {
    "videoId": "3K8TI4qGEsg",
    "title": "\"Звершилося!\" (Івана 19:30). Віталій Зінченко, 07.12.2025",
    "duration": 1255,
    "year": 2025,
    "formattedDate": "08 грудня 2025 року",
    "rawDate": "2025-12-08T07:16:15.000Z"
  },
  {
    "videoId": "jN1QZmcPF-g",
    "title": "\"Божественність Царя\". Андрій Міщенко, 07.12.2025",
    "duration": 1358,
    "year": 2025,
    "formattedDate": "08 грудня 2025 року",
    "rawDate": "2025-12-08T05:48:04.000Z"
  },
  {
    "videoId": "0HxJo-0V8bo",
    "title": "Прославлення Господа 7 грудня 2025 року",
    "duration": 2109,
    "year": 2025,
    "formattedDate": "08 грудня 2025 року",
    "rawDate": "2025-12-08T05:40:53.000Z"
  },
  {
    "videoId": "-xQUceOpWeM",
    "title": "Хліболамання. АДВЕНТ (другий тиждень). Богослужіння 7 грудня 2025 року",
    "duration": 6270,
    "year": 2025,
    "formattedDate": "07 грудня 2025 року",
    "rawDate": "2025-12-07T17:40:34.000Z"
  },
  {
    "videoId": "aR3EbEtnfK4",
    "title": "\"Втішайте Мого народа\" (Іс. 40:1). Андрій Булигін, 30.11.2025",
    "duration": 2586,
    "year": 2025,
    "formattedDate": "30 листопада 2025 року",
    "rawDate": "2025-11-30T20:19:45.000Z"
  },
  {
    "videoId": "ZDuBsPDCvJU",
    "title": "Прославлення Господа 30.11.2025",
    "duration": 2116,
    "year": 2025,
    "formattedDate": "30 листопада 2025 року",
    "rawDate": "2025-11-30T19:37:59.000Z"
  },
  {
    "videoId": "Dblx8yWI3TA",
    "title": "\"Пророцтво і очікування обіцяного Царя\" (Іс. 7:14, Міх. 5:1, Іс. 9:1-6).Віталій Зінченко, 30.11.2025",
    "duration": 1550,
    "year": 2025,
    "formattedDate": "30 листопада 2025 року",
    "rawDate": "2025-11-30T18:17:11.000Z"
  },
  {
    "videoId": "aKA3cncGI8A",
    "title": "АДВЕНТ (перший тиждень). Богослужіння 30.11.2025",
    "duration": 7191,
    "year": 2025,
    "formattedDate": "30 листопада 2025 року",
    "rawDate": "2025-11-30T17:29:42.000Z"
  },
  {
    "videoId": "_3A5-wWxVmk",
    "title": "Прославлення Господа 23 листопада 2025 року",
    "duration": 2163,
    "year": 2025,
    "formattedDate": "28 листопада 2025 року",
    "rawDate": "2025-11-28T08:38:49.000Z"
  },
  {
    "videoId": "QEmCiRfi2kw",
    "title": "\"Настанова для пасторів\" (1 Тимофія 4:12). Валерій Антонюк, 23.11.2025",
    "duration": 2146,
    "year": 2025,
    "formattedDate": "24 листопада 2025 року",
    "rawDate": "2025-11-24T20:47:07.000Z"
  },
  {
    "videoId": "S-x5cfWJwbM",
    "title": "\"Настанова дияконам\" (Дії Апостолів 6:1). Михайло Пімоненко, 23.11.2025",
    "duration": 1295,
    "year": 2025,
    "formattedDate": "24 листопада 2025 року",
    "rawDate": "2025-11-24T17:34:07.000Z"
  },
  {
    "videoId": "nLcwtshS7gA",
    "title": "\"Церква - як центр історії\" (Об'явлення 19:7). Микола Марйоха, 23.11.2025",
    "duration": 771,
    "year": 2025,
    "formattedDate": "24 листопада 2025 року",
    "rawDate": "2025-11-24T16:18:08.000Z"
  },
  {
    "videoId": "WKyAviDN54s",
    "title": "Рукопокладання на пасторське та дияконське служіння, 23.11.2025",
    "duration": 8244,
    "year": 2025,
    "formattedDate": "24 листопада 2025 року",
    "rawDate": "2025-11-24T08:04:18.000Z"
  },
  {
    "videoId": "13XWMuUi4F8",
    "title": "Прославлення Господа 16 листопада 2025 року",
    "duration": 1822,
    "year": 2025,
    "formattedDate": "17 листопада 2025 року",
    "rawDate": "2025-11-17T08:12:08.000Z"
  },
  {
    "videoId": "o6kjqqwCQW0",
    "title": "\"Наблюдай за собой, когда тяжело\" (Луки 17:1-4). Сергей Комисар, 16.11.2025",
    "duration": 2523,
    "year": 2025,
    "formattedDate": "17 листопада 2025 року",
    "rawDate": "2025-11-17T07:37:17.000Z"
  },
  {
    "videoId": "B6SK8no3cMQ",
    "title": "\"Відкинеш, зневажиш чи приймеш Христа?\" (Іс. 53). Андрій Булигін, 16.11.2025",
    "duration": 1890,
    "year": 2025,
    "formattedDate": "17 листопада 2025 року",
    "rawDate": "2025-11-17T06:36:18.000Z"
  },
  {
    "videoId": "anBXZXqNnqI",
    "title": "Богослужіння 16 листопада 2025 року",
    "duration": 7193,
    "year": 2025,
    "formattedDate": "17 листопада 2025 року",
    "rawDate": "2025-11-16T22:51:27.000Z"
  },
  {
    "videoId": "ixDzyefY148",
    "title": "Прославлення Господа 09 листопада 2025 року",
    "duration": 1941,
    "year": 2025,
    "formattedDate": "11 листопада 2025 року",
    "rawDate": "2025-11-11T08:34:28.000Z"
  },
  {
    "videoId": "J9bXTB_OgGQ",
    "title": "\"Що значить пити чашу Ісуса і хреститися Його хрещенням\" (Матв. 20:20-28). Віктор Лаба, 09.11.2025",
    "duration": 2394,
    "year": 2025,
    "formattedDate": "09 листопада 2025 року",
    "rawDate": "2025-11-09T20:44:12.000Z"
  },
  {
    "videoId": "O7wYpVWyc0g",
    "title": "\"Піклуйся про сиріт і вдів\" (Як. 1:27). Віталій Зінченко, 09.11.2025",
    "duration": 1447,
    "year": 2025,
    "formattedDate": "09 листопада 2025 року",
    "rawDate": "2025-11-09T20:26:21.000Z"
  },
  {
    "videoId": "Cr_Zhm5GP5s",
    "title": "Богослужіння 09 листопада 2025 року",
    "duration": 7054,
    "year": 2025,
    "formattedDate": "09 листопада 2025 року",
    "rawDate": "2025-11-09T19:44:46.000Z"
  },
  {
    "videoId": "6grLQKHbBrs",
    "title": "\"Привілеї нового статусу в Ісусі Христі\" (Євр. 10:19-25). Андрій Парфило, 02.11.2025",
    "duration": 2233,
    "year": 2025,
    "formattedDate": "03 листопада 2025 року",
    "rawDate": "2025-11-03T03:27:08.000Z"
  },
  {
    "videoId": "8M19jky-RJU",
    "title": "\"НЕ служіть ідолам\" (1 Кор. 10:14). Микола Марйоха, 02.11.2025",
    "duration": 1237,
    "year": 2025,
    "formattedDate": "02 листопада 2025 року",
    "rawDate": "2025-11-02T19:29:44.000Z"
  },
  {
    "videoId": "T_Ais26JqcE",
    "title": "Прославлення Господа 2 листопада 2025 року",
    "duration": 2132,
    "year": 2025,
    "formattedDate": "02 листопада 2025 року",
    "rawDate": "2025-11-02T18:35:02.000Z"
  },
  {
    "videoId": "cvjX0rJcAJs",
    "title": "Богослужіння 2 листопада 2025 року",
    "duration": 7158,
    "year": 2025,
    "formattedDate": "02 листопада 2025 року",
    "rawDate": "2025-11-02T18:08:16.000Z"
  },
  {
    "videoId": "pLfVguNWsZQ",
    "title": "Прославлення Господа 26 жовтня 2025 року",
    "duration": 1637,
    "year": 2025,
    "formattedDate": "28 жовтня 2025 року",
    "rawDate": "2025-10-28T06:41:03.000Z"
  },
  {
    "videoId": "bTD-FiEC_T8",
    "title": "\"Приготовься дать отчёт\" (Матфея 25:13-46). Сергей Комисар, 26.10.2025",
    "duration": 2738,
    "year": 2025,
    "formattedDate": "28 жовтня 2025 року",
    "rawDate": "2025-10-28T05:37:17.000Z"
  },
  {
    "videoId": "vHtssAlWnrc",
    "title": "\"Два погляди на поклоніння Богу\" (Матвія 15:10-20). Андрій Міщенко, 26.10.2025",
    "duration": 1577,
    "year": 2025,
    "formattedDate": "28 жовтня 2025 року",
    "rawDate": "2025-10-28T03:20:25.000Z"
  },
  {
    "videoId": "112jCNV087k",
    "title": "Богослужіння 26 жовтня 2025 року",
    "duration": 6842,
    "year": 2025,
    "formattedDate": "27 жовтня 2025 року",
    "rawDate": "2025-10-27T12:26:30.000Z"
  },
  {
    "videoId": "v9Prw4Xg2Xo",
    "title": "Прославлення Господа 19 жовтня 2025 року",
    "duration": 1181,
    "year": 2025,
    "formattedDate": "25 жовтня 2025 року",
    "rawDate": "2025-10-25T20:51:58.000Z"
  },
  {
    "videoId": "juhI0U_A1gw",
    "title": "\"Загублені на \"Полі чудес\" (Мтв.6:24-34). Микола Марйоха, 19.10.2025",
    "duration": 2146,
    "year": 2025,
    "formattedDate": "20 жовтня 2025 року",
    "rawDate": "2025-10-20T19:45:02.000Z"
  },
  {
    "videoId": "lcJ3IzROCFg",
    "title": "\"Корінь вирішення проблем у Євангелії Христовій\"(Огляд послання до Римлян).Віталій Зінченко,19.10.25",
    "duration": 1950,
    "year": 2025,
    "formattedDate": "20 жовтня 2025 року",
    "rawDate": "2025-10-20T19:14:23.000Z"
  },
  {
    "videoId": "VoJacU4i3Gc",
    "title": "Богослужіння 19 жовтня 2025 року",
    "duration": 5985,
    "year": 2025,
    "formattedDate": "20 жовтня 2025 року",
    "rawDate": "2025-10-20T17:20:46.000Z"
  },
  {
    "videoId": "7rOCRjhx_BE",
    "title": "Прославлення Господа 12 жовтня 2025 року",
    "duration": 2326,
    "year": 2025,
    "formattedDate": "13 жовтня 2025 року",
    "rawDate": "2025-10-13T05:24:59.000Z"
  },
  {
    "videoId": "X6SLoJEtF2A",
    "title": "\"Народи знатимуть, що Господь є Бог\" (Єзекіїля 38). Андрій Булигін, 12.10.2025",
    "duration": 1682,
    "year": 2025,
    "formattedDate": "13 жовтня 2025 року",
    "rawDate": "2025-10-13T03:03:48.000Z"
  },
  {
    "videoId": "3Z_duAjuaRw",
    "title": "\"Господи,хіба мало тих,які спасаються?\" (Луки 13:22-30). Віктор Лаба, 12.10.2025",
    "duration": 2425,
    "year": 2025,
    "formattedDate": "13 жовтня 2025 року",
    "rawDate": "2025-10-12T21:31:06.000Z"
  },
  {
    "videoId": "Wg7eHf00oFw",
    "title": "Богослужіння 12 жовтня 2025 року",
    "duration": 7366,
    "year": 2025,
    "formattedDate": "12 жовтня 2025 року",
    "rawDate": "2025-10-12T20:06:15.000Z"
  },
  {
    "videoId": "Ic-5HJrg_gs",
    "title": "Прославлення Господа 5 жовтня 2025 року",
    "duration": 1982,
    "year": 2025,
    "formattedDate": "06 жовтня 2025 року",
    "rawDate": "2025-10-06T06:29:34.000Z"
  },
  {
    "videoId": "1tND90_fNjY",
    "title": "Впевненість у могутності Отця (Матвія 27:46-46). Микола Марйоха, 05.10.2025",
    "duration": 1565,
    "year": 2025,
    "formattedDate": "05 жовтня 2025 року",
    "rawDate": "2025-10-05T20:22:20.000Z"
  },
  {
    "videoId": "bGGxQ2fChdo",
    "title": "\"Справедливість: наші очікування VS Божа реальність\" (Об'явлення 6:9-11). Віталій Зінченко, 05.10.25",
    "duration": 1751,
    "year": 2025,
    "formattedDate": "05 жовтня 2025 року",
    "rawDate": "2025-10-05T20:01:37.000Z"
  },
  {
    "videoId": "k2oQlQjG3_4",
    "title": "Богослужіння 5 жовтня 2025 року",
    "duration": 6812,
    "year": 2025,
    "formattedDate": "05 жовтня 2025 року",
    "rawDate": "2025-10-05T19:49:08.000Z"
  },
  {
    "videoId": "qzN4xFWo6t0",
    "title": "Прославлення Господа. Свято Жнив 28.09.2025",
    "duration": 3387,
    "year": 2025,
    "formattedDate": "02 жовтня 2025 року",
    "rawDate": "2025-10-02T18:35:44.000Z"
  },
  {
    "videoId": "P_lwDHXLqMI",
    "title": "\"Земля дала свій урожай\" (Псалом 67:6-8). Микола Марйоха, 28.09.2025",
    "duration": 1429,
    "year": 2025,
    "formattedDate": "28 вересня 2025 року",
    "rawDate": "2025-09-28T19:40:26.000Z"
  },
  {
    "videoId": "D4QIpSAercw",
    "title": "\"Дві причини для хвали Богу\" (Псалом 106). Андрій Міщенко, 28.09.2025",
    "duration": 1290,
    "year": 2025,
    "formattedDate": "28 вересня 2025 року",
    "rawDate": "2025-09-28T18:53:51.000Z"
  },
  {
    "videoId": "whP5mkspsZ4",
    "title": "Свято Жнив. Богослужіння 28 вересня 2025 року",
    "duration": 6861,
    "year": 2025,
    "formattedDate": "28 вересня 2025 року",
    "rawDate": "2025-09-28T18:30:07.000Z"
  },
  {
    "videoId": "mNg_Y0-QEsQ",
    "title": "Прославлення Господа 21 вересня 2025 року",
    "duration": 1972,
    "year": 2025,
    "formattedDate": "22 вересня 2025 року",
    "rawDate": "2025-09-22T06:45:33.000Z"
  },
  {
    "videoId": "HeDPDlBI2hQ",
    "title": "Сімейна модель стосунків у церкві (1 Тим. 5:1-2). Андрій Парфило, 21.09.2025",
    "duration": 2062,
    "year": 2025,
    "formattedDate": "22 вересня 2025 року",
    "rawDate": "2025-09-21T21:36:54.000Z"
  },
  {
    "videoId": "mEfUI6V5OKQ",
    "title": "Богослужіння 21 вересня 2025 року",
    "duration": 7234,
    "year": 2025,
    "formattedDate": "21 вересня 2025 року",
    "rawDate": "2025-09-21T19:26:38.000Z"
  },
  {
    "videoId": "nALsx3QBv5U",
    "title": "\"Кто будет первым, а кто последним  на небе\" (Мтф. 19:16-30). Сергей Комисар, 21.09.2025",
    "duration": 2301,
    "year": 2025,
    "formattedDate": "21 вересня 2025 року",
    "rawDate": "2025-09-21T19:17:02.000Z"
  },
  {
    "videoId": "vWREbWkur8c",
    "title": "Вірш \"Молитись хочу, як молилась Анна\". Катерина Іванченко, 21.09.2025",
    "duration": 246,
    "year": 2025,
    "formattedDate": "21 вересня 2025 року",
    "rawDate": "2025-09-21T18:48:46.000Z"
  },
  {
    "videoId": "epLLC-8PryE",
    "title": "Пісня \"Господом втішаюся\". Тимофій Охріменко, 21.09.2025",
    "duration": 250,
    "year": 2025,
    "formattedDate": "21 вересня 2025 року",
    "rawDate": "2025-09-21T18:42:14.000Z"
  },
  {
    "videoId": "EcF3TwKyWS4",
    "title": "Богослужіння 14.09.2025",
    "duration": 5726,
    "year": 2025,
    "formattedDate": "17 вересня 2025 року",
    "rawDate": "2025-09-17T11:21:35.000Z"
  },
  {
    "videoId": "pvIwSZpUlFo",
    "title": "Богослужіння 07.09.2025. Вечеря Господня.",
    "duration": 7928,
    "year": 2025,
    "formattedDate": "08 вересня 2025 року",
    "rawDate": "2025-09-08T18:45:40.000Z"
  },
  {
    "videoId": "65L3tA7QhKk",
    "title": "Богослужіння 31.08.2025",
    "duration": 6490,
    "year": 2025,
    "formattedDate": "02 вересня 2025 року",
    "rawDate": "2025-09-02T11:42:27.000Z"
  },
  {
    "videoId": "-xGxbVcWNvs",
    "title": "Богослужіння 24.08.2025",
    "duration": 6771,
    "year": 2025,
    "formattedDate": "29 серпня 2025 року",
    "rawDate": "2025-08-29T12:54:09.000Z"
  },
  {
    "videoId": "6WhZ3DjMTJo",
    "title": "Богослужіння 17.08.2025",
    "duration": 7133,
    "year": 2025,
    "formattedDate": "18 серпня 2025 року",
    "rawDate": "2025-08-18T18:49:43.000Z"
  },
  {
    "videoId": "2DxSC8nswdU",
    "title": "Богослужіння 10.08.2025",
    "duration": 6336,
    "year": 2025,
    "formattedDate": "10 серпня 2025 року",
    "rawDate": "2025-08-10T19:16:46.000Z"
  },
  {
    "videoId": "hr0HSG10N0w",
    "title": "Вечірнє Богослужіння 06.08.2025. Свято Преображення.",
    "duration": 4302,
    "year": 2025,
    "formattedDate": "09 серпня 2025 року",
    "rawDate": "2025-08-09T06:46:01.000Z"
  },
  {
    "videoId": "KSJlVZFf6fA",
    "title": "Богослужіння 03.08.2025. Вечеря Господня.",
    "duration": 8010,
    "year": 2025,
    "formattedDate": "04 серпня 2025 року",
    "rawDate": "2025-08-04T08:09:19.000Z"
  },
  {
    "videoId": "4GdQc5Yr46M",
    "title": "Богослужіння 27.07.2025",
    "duration": 6505,
    "year": 2025,
    "formattedDate": "27 липня 2025 року",
    "rawDate": "2025-07-27T19:19:10.000Z"
  },
  {
    "videoId": "thjWpND7P3w",
    "title": "\"Не забудь помолитися  Богу\". Загальний спів, 20.07.2025",
    "duration": 168,
    "year": 2025,
    "formattedDate": "22 липня 2025 року",
    "rawDate": "2025-07-22T05:23:06.000Z"
  },
  {
    "videoId": "r6qtrUX_fog",
    "title": "\"Останнє слово завжди каже Бог\". Читає вірш Катерина Іванченко, 20.07.2025",
    "duration": 156,
    "year": 2025,
    "formattedDate": "22 липня 2025 року",
    "rawDate": "2025-07-22T04:42:19.000Z"
  },
  {
    "videoId": "xVk755mqsFI",
    "title": "\"Небо\". Тимофей и Владислав Охрименки, 20.07.2025",
    "duration": 292,
    "year": 2025,
    "formattedDate": "21 липня 2025 року",
    "rawDate": "2025-07-21T08:36:01.000Z"
  },
  {
    "videoId": "uh_pfev0WAc",
    "title": "\"Найбільший скарб колосян\" (Кол 1:1-2). Олександр Іванченко, 20.07.2025",
    "duration": 2259,
    "year": 2025,
    "formattedDate": "21 липня 2025 року",
    "rawDate": "2025-07-21T08:28:48.000Z"
  },
  {
    "videoId": "R8O_G2fphFM",
    "title": "\"Перемога над спокусами\" (Матвія 4:1-11). Андрій Міщенко, 20.07.2025",
    "duration": 1677,
    "year": 2025,
    "formattedDate": "21 липня 2025 року",
    "rawDate": "2025-07-21T07:18:01.000Z"
  },
  {
    "videoId": "W_3ObPALuYk",
    "title": "Богослужіння 20 липня 2025 року",
    "duration": 6342,
    "year": 2025,
    "formattedDate": "20 липня 2025 року",
    "rawDate": "2025-07-20T19:51:04.000Z"
  },
  {
    "videoId": "Q41dQpwI4sc",
    "title": "\"Небезпеки при молитві\" (Мтф. 6:5-15). Микола Марйоха, 13.07.2025",
    "duration": 1777,
    "year": 2025,
    "formattedDate": "13 липня 2025 року",
    "rawDate": "2025-07-13T18:11:13.000Z"
  },
  {
    "videoId": "ZFARUujQCKo",
    "title": "\"Надія юності перевіриться в старості\" (Псалом 71). Андрій Парфило, 13.07.2025",
    "duration": 2097,
    "year": 2025,
    "formattedDate": "13 липня 2025 року",
    "rawDate": "2025-07-13T15:43:55.000Z"
  },
  {
    "videoId": "9Bngn9yg6C4",
    "title": "Богослужіння 13 липня 2025 року",
    "duration": 6139,
    "year": 2025,
    "formattedDate": "13 липня 2025 року",
    "rawDate": "2025-07-13T13:52:13.000Z"
  },
  {
    "videoId": "mlvu_EkXMNA",
    "title": "\"Світло життя\". Група, 06.07.2025",
    "duration": 213,
    "year": 2025,
    "formattedDate": "08 липня 2025 року",
    "rawDate": "2025-07-08T15:15:09.000Z"
  },
  {
    "videoId": "ljXNsK2Ec7c",
    "title": "\"Ви - лист Христів\" (2 Кор 3:3). Микола Марйоха, 06.07.2025",
    "duration": 1210,
    "year": 2025,
    "formattedDate": "08 липня 2025 року",
    "rawDate": "2025-07-08T07:24:36.000Z"
  },
  {
    "videoId": "GMUupxFukck",
    "title": "\"Парадокс духовного життя\" (Рим 6:1-14). Олександр Іванченко, 06.07.2025",
    "duration": 1848,
    "year": 2025,
    "formattedDate": "08 липня 2025 року",
    "rawDate": "2025-07-08T01:49:56.000Z"
  },
  {
    "videoId": "bzNbkBo9qE8",
    "title": "\"Если кажется, что небо закрывается\". Тимофей и Владислав Охрименки, 06.07.2025",
    "duration": 269,
    "year": 2025,
    "formattedDate": "07 липня 2025 року",
    "rawDate": "2025-07-07T15:53:02.000Z"
  },
  {
    "videoId": "vofgqSikTBI",
    "title": "Богослужіння 6 липня 2025 року",
    "duration": 7532,
    "year": 2025,
    "formattedDate": "07 липня 2025 року",
    "rawDate": "2025-07-07T09:07:02.000Z"
  },
  {
    "videoId": "BgmUQHCFDhg",
    "title": "Привітання охрещених 6 липня 2025 року",
    "duration": 350,
    "year": 2025,
    "formattedDate": "06 липня 2025 року",
    "rawDate": "2025-07-06T16:46:10.000Z"
  },
  {
    "videoId": "DeRL9OTYwOM",
    "title": "Фрагмент Богослужіння 6 липня 2025 року",
    "duration": 256,
    "year": 2025,
    "formattedDate": "06 липня 2025 року",
    "rawDate": "2025-07-06T10:04:53.000Z"
  },
  {
    "videoId": "kvKzh7FLuzU",
    "title": "\"Огляд книг, які написав Лука\" (Лука 24:45-48). Віталій Зінченко, 29.06.2025",
    "duration": 2679,
    "year": 2025,
    "formattedDate": "30 червня 2025 року",
    "rawDate": "2025-06-30T06:12:58.000Z"
  },
  {
    "videoId": "q5DkJbyvLc0",
    "title": "\"Благослови душе моя Господа\"(Пс 103). Андрій Міщенко, 29.06.2025",
    "duration": 1125,
    "year": 2025,
    "formattedDate": "30 червня 2025 року",
    "rawDate": "2025-06-30T05:30:19.000Z"
  },
  {
    "videoId": "gwEUAOB_kVc",
    "title": "Богослужіння 29 червня 2025 року",
    "duration": 5548,
    "year": 2025,
    "formattedDate": "30 червня 2025 року",
    "rawDate": "2025-06-30T05:18:01.000Z"
  },
  {
    "videoId": "nYRgoFICI5Q",
    "title": "\"Притча про смоковницю та всі дерева. Виконання пророцтв\" (Луки 21:29). Віктор Лаба, 22.06.2025",
    "duration": 2745,
    "year": 2025,
    "formattedDate": "23 червня 2025 року",
    "rawDate": "2025-06-23T17:19:23.000Z"
  },
  {
    "videoId": "YZlX2OzGRdo",
    "title": "\"Не хлібна закваска\" (Лук. 12:1-3). Андрій Парфило, 22.06.2025",
    "duration": 2199,
    "year": 2025,
    "formattedDate": "23 червня 2025 року",
    "rawDate": "2025-06-23T17:00:26.000Z"
  },
  {
    "videoId": "pT-bYJnysJY",
    "title": "Богослужіння 22 червня 2025 року",
    "duration": 7355,
    "year": 2025,
    "formattedDate": "23 червня 2025 року",
    "rawDate": "2025-06-23T10:50:24.000Z"
  },
  {
    "videoId": "4SYxCcoHY6g",
    "title": "\"Біблійний Отець\" (2 Тим. 1:1-3). Віталій Зінченко, 15.06.2025",
    "duration": 2570,
    "year": 2025,
    "formattedDate": "17 червня 2025 року",
    "rawDate": "2025-06-17T20:04:13.000Z"
  },
  {
    "videoId": "d-OVswKdl4s",
    "title": "\"Добрі справи - без нагороди\" (Матф. 6:1-4). Микола Марйоха, 15.06.2025",
    "duration": 1701,
    "year": 2025,
    "formattedDate": "16 червня 2025 року",
    "rawDate": "2025-06-16T09:18:45.000Z"
  },
  {
    "videoId": "2TNhkInHSzs",
    "title": "Служіння 15 червня 2025 року",
    "duration": 6614,
    "year": 2025,
    "formattedDate": "15 червня 2025 року",
    "rawDate": "2025-06-15T15:33:26.000Z"
  },
  {
    "videoId": "uaaY2ou5e_0",
    "title": "\"Місія Святого Духа\" (Д.А. 2:1-24). Микола Марйоха, 08.06.2025",
    "duration": 2039,
    "year": 2025,
    "formattedDate": "15 червня 2025 року",
    "rawDate": "2025-06-15T06:02:26.000Z"
  },
  {
    "videoId": "Bj98rE5txak",
    "title": "\"Допоміг нам у всьому Господь\". Владислав та Тимофій Охріменки, 08.06.2025",
    "duration": 295,
    "year": 2025,
    "formattedDate": "15 червня 2025 року",
    "rawDate": "2025-06-15T05:59:40.000Z"
  },
  {
    "videoId": "szPziauXG2A",
    "title": "\"Христос - Засновник Церкви\" (Мф. 16:18). Андрій Парфило, 08.06.2025",
    "duration": 1046,
    "year": 2025,
    "formattedDate": "11 червня 2025 року",
    "rawDate": "2025-06-11T07:40:13.000Z"
  },
  {
    "videoId": "WdWHpZdrZr8",
    "title": "Служіння 8 червня 2025 року",
    "duration": 5499,
    "year": 2025,
    "formattedDate": "09 червня 2025 року",
    "rawDate": "2025-06-09T09:56:50.000Z"
  },
  {
    "videoId": "fka1t0XTwO8",
    "title": "Загальний спів 8 червня 2025 року",
    "duration": 146,
    "year": 2025,
    "formattedDate": "09 червня 2025 року",
    "rawDate": "2025-06-09T05:05:24.000Z"
  },
  {
    "videoId": "rxh3HgEgbn8",
    "title": "Фундамент віри і цінностей у вихованні дітей. День 4. 05.06.2025",
    "duration": 6893,
    "year": 2025,
    "formattedDate": "07 червня 2025 року",
    "rawDate": "2025-06-07T10:29:53.000Z"
  },
  {
    "videoId": "fYIMUjN11No",
    "title": "Фундамент віри і цінностей у вихованні дітей. День 3. 04.06.2025",
    "duration": 4976,
    "year": 2025,
    "formattedDate": "05 червня 2025 року",
    "rawDate": "2025-06-05T03:51:06.000Z"
  },
  {
    "videoId": "ebPT5AI7gpg",
    "title": "Фундамент віри і цінностей у вихованні дітей. День 2. 03.06.2025",
    "duration": 5925,
    "year": 2025,
    "formattedDate": "04 червня 2025 року",
    "rawDate": "2025-06-04T05:25:38.000Z"
  },
  {
    "videoId": "kpJdfDDva80",
    "title": "Фундамент віри і цінностей у вихованні дітей. День 1. 02.06.2025",
    "duration": 4583,
    "year": 2025,
    "formattedDate": "04 червня 2025 року",
    "rawDate": "2025-06-04T05:13:23.000Z"
  },
  {
    "videoId": "wrATptvC9No",
    "title": "\"Хрест Ісуса - шлях добровільної покори\" ( Івана 19:16-22). Микола Марйоха, 01.06.2025",
    "duration": 1254,
    "year": 2025,
    "formattedDate": "03 червня 2025 року",
    "rawDate": "2025-06-03T05:33:38.000Z"
  },
  {
    "videoId": "9qZP28rWf18",
    "title": "\"Кому дається спокій\" (Матвія 11:28-30). Віталій Зінченко, 01.06.2025",
    "duration": 1786,
    "year": 2025,
    "formattedDate": "03 червня 2025 року",
    "rawDate": "2025-06-03T05:19:15.000Z"
  },
  {
    "videoId": "jKWp904HyOU",
    "title": "Служіння 1 червня 2025 року",
    "duration": 6410,
    "year": 2025,
    "formattedDate": "03 червня 2025 року",
    "rawDate": "2025-06-03T05:11:40.000Z"
  },
  {
    "videoId": "PpErIYD-m1M",
    "title": "\"Могутність Євангелія Ісуса Христа\" (Римлян 1:16-17). Андрій Парфило, 25.05.2025",
    "duration": 2462,
    "year": 2025,
    "formattedDate": "28 травня 2025 року",
    "rawDate": "2025-05-28T16:36:46.000Z"
  },
  {
    "videoId": "XOVARNUFNs4",
    "title": "\"День Господній\" (Іс. 2:7-22). Андрій Булигін, 25.05.2025",
    "duration": 2799,
    "year": 2025,
    "formattedDate": "28 травня 2025 року",
    "rawDate": "2025-05-28T11:04:26.000Z"
  },
  {
    "videoId": "AZas2neRvMM",
    "title": "Служіння 25 травня 2025 року",
    "duration": 6753,
    "year": 2025,
    "formattedDate": "26 травня 2025 року",
    "rawDate": "2025-05-26T14:28:23.000Z"
  },
  {
    "videoId": "MU72PSEmOWI",
    "title": "\"Ми вічнії з тобою\". Тимофій та Владислав Охріменки, 18.05.2025",
    "duration": 212,
    "year": 2025,
    "formattedDate": "20 травня 2025 року",
    "rawDate": "2025-05-20T18:55:05.000Z"
  },
  {
    "videoId": "vpHPjzUf_84",
    "title": "\"Божа  любов до всіх людей\" (Матвія 5:43-48). Микола МАРЙОХА, 18.05.2025",
    "duration": 2654,
    "year": 2025,
    "formattedDate": "20 травня 2025 року",
    "rawDate": "2025-05-20T11:19:17.000Z"
  },
  {
    "videoId": "JxQRCkPOA0Y",
    "title": "\"І Дух, і наречена говорять: \"Прийди!\" (Одкровення 22). Віктор Лаба, 18.05.2025",
    "duration": 1987,
    "year": 2025,
    "formattedDate": "20 травня 2025 року",
    "rawDate": "2025-05-20T10:08:36.000Z"
  },
  {
    "videoId": "-REX9Y8Mz3I",
    "title": "Служіння 18 травня 2025 року",
    "duration": 6973,
    "year": 2025,
    "formattedDate": "20 травня 2025 року",
    "rawDate": "2025-05-20T04:40:42.000Z"
  },
  {
    "videoId": "TjoAIIcW6UY",
    "title": "\"Неспроможність теорії лайтового християнства\"(Марка 8:27-38). Андрій Парфило, 11.05.2025",
    "duration": 2442,
    "year": 2025,
    "formattedDate": "13 травня 2025 року",
    "rawDate": "2025-05-13T17:24:08.000Z"
  },
  {
    "videoId": "8Jvvz4dAe8Q",
    "title": "\"Суть практического благочестия\" (Иак. 1:27). Сергей Комисар, 11.05.2025",
    "duration": 2923,
    "year": 2025,
    "formattedDate": "13 травня 2025 року",
    "rawDate": "2025-05-13T16:20:27.000Z"
  },
  {
    "videoId": "PCdOLzRiKN0",
    "title": "Служіння 11 травня 2025 року",
    "duration": 7720,
    "year": 2025,
    "formattedDate": "13 травня 2025 року",
    "rawDate": "2025-05-13T09:40:44.000Z"
  },
  {
    "videoId": "7bqAM2y9smU",
    "title": "\"Вечеря Господня - частина великої Євангелії\" (1 Коринтян 15:1-3). Микола Марйоха, 04.05.2025",
    "duration": 1539,
    "year": 2025,
    "formattedDate": "05 травня 2025 року",
    "rawDate": "2025-05-05T05:45:38.000Z"
  },
  {
    "videoId": "3e1RKOdNR78",
    "title": "\"Гріх руйнує, а Божа благодать дарує життя\" (Псалом 51). Андрій Міщенко, 04.05.2025",
    "duration": 1485,
    "year": 2025,
    "formattedDate": "05 травня 2025 року",
    "rawDate": "2025-05-05T05:05:51.000Z"
  },
  {
    "videoId": "RTIF6rE1B6g",
    "title": "\"Є смерть, що дає життя\". Юлія, Владислав, Тимофій Охріменки (04.05.2025).",
    "duration": 229,
    "year": 2025,
    "formattedDate": "04 травня 2025 року",
    "rawDate": "2025-05-04T18:11:40.000Z"
  },
  {
    "videoId": "yNCoTC3jrWQ",
    "title": "Служіння 4 травня 2025 року",
    "duration": 6848,
    "year": 2025,
    "formattedDate": "04 травня 2025 року",
    "rawDate": "2025-05-04T17:25:50.000Z"
  },
  {
    "videoId": "sDSRgvCLx10",
    "title": "\"Милість Господа\". Загальний спів, 04.05.2025",
    "duration": 312,
    "year": 2025,
    "formattedDate": "04 травня 2025 року",
    "rawDate": "2025-05-04T12:05:01.000Z"
  },
  {
    "videoId": "Cok5-Y3XtzU",
    "title": "\"Не дивись з тривогою у завтра\". Тимофій, Юлія та Владислав Охріменки. 27.04.2025",
    "duration": 176,
    "year": 2025,
    "formattedDate": "27 квітня 2025 року",
    "rawDate": "2025-04-27T18:54:06.000Z"
  },
  {
    "videoId": "yoSq3SB_EJA",
    "title": "Служіння 27 квітня 2025 року",
    "duration": 7222,
    "year": 2025,
    "formattedDate": "27 квітня 2025 року",
    "rawDate": "2025-04-27T18:35:58.000Z"
  },
  {
    "videoId": "6l41jeRxUjw",
    "title": "\"Євангеліє до римлян\" (Марка 10:45). Віталій Зінченко, 27.04.2021",
    "duration": 1620,
    "year": 2025,
    "formattedDate": "27 квітня 2025 року",
    "rawDate": "2025-04-27T16:02:23.000Z"
  },
  {
    "videoId": "w2LE0eTl1oQ",
    "title": "\"Христос - наша надія\" (1 Тимофія 1:1). Андрій Булигін, 27.04.2025",
    "duration": 3436,
    "year": 2025,
    "formattedDate": "27 квітня 2025 року",
    "rawDate": "2025-04-27T14:40:38.000Z"
  },
  {
    "videoId": "x1_FuaAIJK8",
    "title": "\"О, який нам щасливий Бог день дарував\". Загальний спів, 27.04.2025",
    "duration": 186,
    "year": 2025,
    "formattedDate": "27 квітня 2025 року",
    "rawDate": "2025-04-27T10:30:01.000Z"
  },
  {
    "videoId": "ihkBORnnVZA",
    "title": "\"Ты Христос умирая\". Влад та Тимофей Охрименки, 17.04.2025",
    "duration": 222,
    "year": 2025,
    "formattedDate": "27 квітня 2025 року",
    "rawDate": "2025-04-27T04:14:47.000Z"
  },
  {
    "videoId": "pAZCYkPoHM0",
    "title": "\"Всиновлені в Ісусі\" (Ефесян 1:3-11). Микола Марйоха, 17.04.2025",
    "duration": 925,
    "year": 2025,
    "formattedDate": "27 квітня 2025 року",
    "rawDate": "2025-04-27T04:06:33.000Z"
  },
  {
    "videoId": "Hq-xHCmu8YM",
    "title": "(Ісаї 57). Андрій Булигін, 17.04.2025",
    "duration": 1174,
    "year": 2025,
    "formattedDate": "26 квітня 2025 року",
    "rawDate": "2025-04-26T20:50:59.000Z"
  },
  {
    "videoId": "OJfPLFyEcho",
    "title": "Служіння 17 квітня 2025 року",
    "duration": 4869,
    "year": 2025,
    "formattedDate": "26 квітня 2025 року",
    "rawDate": "2025-04-26T19:45:45.000Z"
  },
  {
    "videoId": "MFNDvlvs0Fo",
    "title": "\"Навіки\". Хор церкви \"Дім Євангелія\", 20.04.2025",
    "duration": 213,
    "year": 2025,
    "formattedDate": "23 квітня 2025 року",
    "rawDate": "2025-04-23T04:48:19.000Z"
  },
  {
    "videoId": "A7y82iRvOiM",
    "title": "\"Вірим ми\". Хор церкви ЄХБ \"Дім Євангелія\"",
    "duration": 262,
    "year": 2025,
    "formattedDate": "22 квітня 2025 року",
    "rawDate": "2025-04-22T19:12:25.000Z"
  },
  {
    "videoId": "k0dcnE2OTUA",
    "title": "\"У підніжжя хреста\". Олена Приходько,20.04.2025",
    "duration": 215,
    "year": 2025,
    "formattedDate": "22 квітня 2025 року",
    "rawDate": "2025-04-22T18:46:18.000Z"
  },
  {
    "videoId": "ONe9IThhklU",
    "title": "\"Чудо із чудес - наш Христос ВОСКРЕС\". Тимофій та Влад Охріменки, 20.04.2025",
    "duration": 244,
    "year": 2025,
    "formattedDate": "22 квітня 2025 року",
    "rawDate": "2025-04-22T17:21:46.000Z"
  },
  {
    "videoId": "BDUSrl_QfdI",
    "title": "Служіння 20 квітня 2025 року",
    "duration": 6995,
    "year": 2025,
    "formattedDate": "21 квітня 2025 року",
    "rawDate": "2025-04-21T11:26:51.000Z"
  },
  {
    "videoId": "-rDgD-UCHMw",
    "title": "\"Воскресіння Христа - перемога над смертю\" (Луки 24:5-6). Микола Марйоха, 20.04.2025",
    "duration": 1524,
    "year": 2025,
    "formattedDate": "21 квітня 2025 року",
    "rawDate": "2025-04-21T10:21:47.000Z"
  },
  {
    "videoId": "hSqlr1hOA14",
    "title": "\"Пошук улюбленого Вчителя\" (Івана 20:10-18). Андрій Парфило, 20.04.2025",
    "duration": 1432,
    "year": 2025,
    "formattedDate": "21 квітня 2025 року",
    "rawDate": "2025-04-21T09:47:52.000Z"
  },
  {
    "videoId": "b09v-VN1rKM",
    "title": "\"Бог нас всіх так любить\". Загальний спів 20.04.2025",
    "duration": 208,
    "year": 2025,
    "formattedDate": "20 квітня 2025 року",
    "rawDate": "2025-04-20T11:11:50.000Z"
  },
  {
    "videoId": "Imc69ApV4Xw",
    "title": "\"Якщо сил немає і втомився ти\". Влад и Тимофій Охріменки, 13.04.2025",
    "duration": 232,
    "year": 2025,
    "formattedDate": "20 квітня 2025 року",
    "rawDate": "2025-04-20T07:43:23.000Z"
  },
  {
    "videoId": "eCNm6bBZV40",
    "title": "\"Туга Христа за Єрусалимом\" (Луки 19:29-44). Микола Марйоха, 13.04.2025",
    "duration": 1963,
    "year": 2025,
    "formattedDate": "14 квітня 2025 року",
    "rawDate": "2025-04-14T19:55:38.000Z"
  },
  {
    "videoId": "m6QHDUgrDq8",
    "title": "\"Право связывать небесное на земле\" (Мтф. 16:18-19). Сергей Комисар, 13.04.2025",
    "duration": 2688,
    "year": 2025,
    "formattedDate": "14 квітня 2025 року",
    "rawDate": "2025-04-14T16:34:32.000Z"
  },
  {
    "videoId": "62WMFoPNYkI",
    "title": "Служіння 13 квітня 2025 року",
    "duration": 7371,
    "year": 2025,
    "formattedDate": "14 квітня 2025 року",
    "rawDate": "2025-04-14T06:08:18.000Z"
  },
  {
    "videoId": "qpqYU1cU92Y",
    "title": "Служіння 6 квітня 2025 року",
    "duration": 6211,
    "year": 2025,
    "formattedDate": "08 квітня 2025 року",
    "rawDate": "2025-04-08T08:03:33.000Z"
  },
  {
    "videoId": "fKAqx5FxzSA",
    "title": "\"Завіса в Храмі\" (Мк. 15:37-38). Віталій Зінченко, 06.04.2025",
    "duration": 1361,
    "year": 2025,
    "formattedDate": "08 квітня 2025 року",
    "rawDate": "2025-04-08T05:33:01.000Z"
  },
  {
    "videoId": "OnZ1pE_wB-g",
    "title": "\"Без чого НЕ можна звершувати Заповідь Господню? (Івана 17:7-8). Микола Марйоха, 06.04.2025",
    "duration": 1614,
    "year": 2025,
    "formattedDate": "07 квітня 2025 року",
    "rawDate": "2025-04-07T10:41:12.000Z"
  },
  {
    "videoId": "cs_t78wyjuM",
    "title": "\"Твоя смерть и воскресенье\". Тимофей и Влад Охрименки, 06.04.2025",
    "duration": 220,
    "year": 2025,
    "formattedDate": "07 квітня 2025 року",
    "rawDate": "2025-04-07T09:14:28.000Z"
  },
  {
    "videoId": "UtYm1w3T878",
    "title": "\"Бог, який чинить чудеса\" (Луки 1:38). Микола Марйоха, 25.03.2025",
    "duration": 1283,
    "year": 2025,
    "formattedDate": "06 квітня 2025 року",
    "rawDate": "2025-04-05T21:13:38.000Z"
  },
  {
    "videoId": "dAjhSNxmnak",
    "title": "\"Звістка, яка принесла благо всім людям\" (Луки 1:26-38). Андрій Парфило, 25.03.2025",
    "duration": 2817,
    "year": 2025,
    "formattedDate": "05 квітня 2025 року",
    "rawDate": "2025-04-05T20:22:54.000Z"
  },
  {
    "videoId": "7yK5RLgrVQs",
    "title": "Свято Благовіщення. Служіння 25 березня 2025 року.",
    "duration": 4819,
    "year": 2025,
    "formattedDate": "05 квітня 2025 року",
    "rawDate": "2025-04-05T18:45:09.000Z"
  },
  {
    "videoId": "8I1Teb7k_Vg",
    "title": "\"Однажды я понял особенно остро\" Тимофей Охрименко, 30.03.2025",
    "duration": 266,
    "year": 2025,
    "formattedDate": "03 квітня 2025 року",
    "rawDate": "2025-04-03T19:55:49.000Z"
  },
  {
    "videoId": "VjeJmGg6e_Y",
    "title": "\"Нові  небо і земля.  Небесний Єрусалим\" (Одкр. 21). Віктор Лаба, 30.03.2025",
    "duration": 2304,
    "year": 2025,
    "formattedDate": "03 квітня 2025 року",
    "rawDate": "2025-04-03T11:23:31.000Z"
  },
  {
    "videoId": "bUBYNrRbWkQ",
    "title": "\"Вірні Божі служителі, які проголошують істинну благодать\"(1Пет 15:12-14).Олександр Іванченко, 03.25",
    "duration": 2707,
    "year": 2025,
    "formattedDate": "03 квітня 2025 року",
    "rawDate": "2025-04-03T10:32:13.000Z"
  },
  {
    "videoId": "MjFmL5-F-Sk",
    "title": "Служіння 30 березня 2025 року",
    "duration": 7594,
    "year": 2025,
    "formattedDate": "31 березня 2025 року",
    "rawDate": "2025-03-31T07:22:09.000Z"
  },
  {
    "videoId": "NLGJR6DF8xc",
    "title": "\"Радісна Новина!\" (Іс. 61:1-9). Андрій Булигін, 23.03.2025",
    "duration": 2251,
    "year": 2025,
    "formattedDate": "24 березня 2025 року",
    "rawDate": "2025-03-23T23:08:40.000Z"
  },
  {
    "videoId": "h1vUMLcaZZQ",
    "title": "\"Від загибелі до життя\" (Лк. 19:1-10). Андрій Міщенко, 23.03.2025",
    "duration": 1790,
    "year": 2025,
    "formattedDate": "24 березня 2025 року",
    "rawDate": "2025-03-23T22:57:10.000Z"
  },
  {
    "videoId": "G776iSezhDk",
    "title": "Служіння 23 березня 2025 року",
    "duration": 6553,
    "year": 2025,
    "formattedDate": "24 березня 2025 року",
    "rawDate": "2025-03-23T22:20:45.000Z"
  },
  {
    "videoId": "2INp3C81xYQ",
    "title": "Заклик до християн від Андрія Парфило",
    "duration": 55,
    "year": 2025,
    "formattedDate": "23 березня 2025 року",
    "rawDate": "2025-03-23T21:04:29.000Z"
  },
  {
    "videoId": "OBu4QkNDRjI",
    "title": "\"Влада Божого провидіння в виконанні Його плану\" (Дії 12). Андрій Парфило, 16.03.2025",
    "duration": 2194,
    "year": 2025,
    "formattedDate": "19 березня 2025 року",
    "rawDate": "2025-03-19T20:27:29.000Z"
  },
  {
    "videoId": "eySy02w9rYc",
    "title": "\"Уроки из притчи о плевелах\" (Матфея 13:24-30). Сергей Комисар, 16.03.2025",
    "duration": 3275,
    "year": 2025,
    "formattedDate": "19 березня 2025 року",
    "rawDate": "2025-03-19T19:02:16.000Z"
  },
  {
    "videoId": "tLGHgmL7fdY",
    "title": "Служіння 16 березня 2025 року",
    "duration": 6834,
    "year": 2025,
    "formattedDate": "19 березня 2025 року",
    "rawDate": "2025-03-19T05:30:29.000Z"
  },
  {
    "videoId": "3QgSlHHlS8c",
    "title": "\"Пізнання Бога\" (Кол. 2:6-10). Анатолій Нінічук, 09.03.2025",
    "duration": 1374,
    "year": 2025,
    "formattedDate": "10 березня 2025 року",
    "rawDate": "2025-03-10T08:09:00.000Z"
  },
  {
    "videoId": "xYAXvTj3tUI",
    "title": "\"Изменение сердец братьев Иосифа\" (Бытие 43:33-34). Александр Кирсанов, 09.03.2025",
    "duration": 1756,
    "year": 2025,
    "formattedDate": "10 березня 2025 року",
    "rawDate": "2025-03-10T07:38:50.000Z"
  },
  {
    "videoId": "M-qIfRl1rkg",
    "title": "\"З хаосу до порядку\" (Буття 1:1-3). Олег Кадацький, 09.03.2025",
    "duration": 453,
    "year": 2025,
    "formattedDate": "10 березня 2025 року",
    "rawDate": "2025-03-10T06:53:21.000Z"
  },
  {
    "videoId": "vpNG4EoxIhI",
    "title": "Служіння 9 березня 2025 року",
    "duration": 6536,
    "year": 2025,
    "formattedDate": "10 березня 2025 року",
    "rawDate": "2025-03-10T06:42:06.000Z"
  },
  {
    "videoId": "ox5ZSR3CaTw",
    "title": "\"А где-то за окном облака\". Влад и Тимофей Охрименки, 09.03.2025",
    "duration": 301,
    "year": 2025,
    "formattedDate": "09 березня 2025 року",
    "rawDate": "2025-03-09T20:16:09.000Z"
  },
  {
    "videoId": "EXJ-LqotU3Y",
    "title": "\"Старый Крест\". Тимофей Охрименко, 02.03.2025",
    "duration": 272,
    "year": 2025,
    "formattedDate": "09 березня 2025 року",
    "rawDate": "2025-03-09T19:03:33.000Z"
  },
  {
    "videoId": "M6t9MbDzy-s",
    "title": "\"Вплив смерті Христа на людину\" (Марка 15:30-33). Дмитро Рябченко, 02.03.2025",
    "duration": 2459,
    "year": 2025,
    "formattedDate": "03 березня 2025 року",
    "rawDate": "2025-03-03T07:31:26.000Z"
  },
  {
    "videoId": "euyyXiQmE4Q",
    "title": "\"Вечеря Господня як знак єдності з Ісусом й один з одним (Івана 6:54). Микола Марйоха, 02.03.2025",
    "duration": 1488,
    "year": 2025,
    "formattedDate": "03 березня 2025 року",
    "rawDate": "2025-03-03T07:25:08.000Z"
  },
  {
    "videoId": "3C5kNAK_HNA",
    "title": "Служіння 2 березня 2025 року",
    "duration": 7004,
    "year": 2025,
    "formattedDate": "03 березня 2025 року",
    "rawDate": "2025-03-03T07:01:05.000Z"
  },
  {
    "videoId": "oJxdzt0mHsA",
    "title": "\"Байдужість - найбільше горе нашого часу\" (Матвія 11:16-30). Олександр Іванченко, 23.02.2025",
    "duration": 2234,
    "year": 2025,
    "formattedDate": "24 лютого 2025 року",
    "rawDate": "2025-02-24T13:39:08.000Z"
  },
  {
    "videoId": "bCmHBUwaPEo",
    "title": "\"Как плод созревает от Слова\" (Матфея 13). Сергей Комисар, 23.02.2025",
    "duration": 2751,
    "year": 2025,
    "formattedDate": "24 лютого 2025 року",
    "rawDate": "2025-02-24T13:09:04.000Z"
  },
  {
    "videoId": "xJGlucTZ1IQ",
    "title": "Служіння 23 лютого 2025 року",
    "duration": 7300,
    "year": 2025,
    "formattedDate": "24 лютого 2025 року",
    "rawDate": "2025-02-24T08:33:13.000Z"
  },
  {
    "videoId": "d8x9QeWLl3A",
    "title": "\"НЕ чини помсти\" (Матвія 5:38-42) Микола Марйоха, 16.02.2025",
    "duration": 2289,
    "year": 2025,
    "formattedDate": "17 лютого 2025 року",
    "rawDate": "2025-02-17T20:57:27.000Z"
  },
  {
    "videoId": "ZeF2wUWsX0M",
    "title": "\"Будьте плодоносны\" (Иоанна 15:16)Брат Николай , г.Лебедин",
    "duration": 2343,
    "year": 2025,
    "formattedDate": "17 лютого 2025 року",
    "rawDate": "2025-02-17T20:45:50.000Z"
  },
  {
    "videoId": "djttQNvJlAA",
    "title": "Служіння 16 лютого 2025 року",
    "duration": 6742,
    "year": 2025,
    "formattedDate": "17 лютого 2025 року",
    "rawDate": "2025-02-17T20:36:30.000Z"
  },
  {
    "videoId": "cPitFHnOpj8",
    "title": "\"Диявол в кайданах, два воскресіння і останній суд\" (Одкр. 20). Віктор Лаба, 09.02.2025",
    "duration": 2537,
    "year": 2025,
    "formattedDate": "10 лютого 2025 року",
    "rawDate": "2025-02-10T00:54:13.000Z"
  },
  {
    "videoId": "7LgQJa4YzkE",
    "title": "\"Великий експеримент\" (Мал. 3:10). Андрій Булигін, 09.02.2025",
    "duration": 2103,
    "year": 2025,
    "formattedDate": "10 лютого 2025 року",
    "rawDate": "2025-02-10T00:28:35.000Z"
  },
  {
    "videoId": "B7El2GwmhJo",
    "title": "Служіння 9 лютого 2025 року",
    "duration": 7009,
    "year": 2025,
    "formattedDate": "10 лютого 2025 року",
    "rawDate": "2025-02-09T23:59:58.000Z"
  },
  {
    "videoId": "iVJDzV4V7EU",
    "title": "\"Висит страдая, распят Христос\". Влад и Тимофей Охрименки, 02.02.2025",
    "duration": 264,
    "year": 2025,
    "formattedDate": "03 лютого 2025 року",
    "rawDate": "2025-02-03T12:23:29.000Z"
  },
  {
    "videoId": "Wzzg9Td2yAw",
    "title": "Прославлення Господа від брата Віктора, м.Вінниця, 02.02.2024",
    "duration": 1042,
    "year": 2025,
    "formattedDate": "03 лютого 2025 року",
    "rawDate": "2025-02-03T12:00:13.000Z"
  },
  {
    "videoId": "aNYKvDWhhLQ",
    "title": "\"Місія Месії\" (Марка 15:1-47). Микола Марйоха, 02.02.2025",
    "duration": 978,
    "year": 2025,
    "formattedDate": "03 лютого 2025 року",
    "rawDate": "2025-02-03T07:33:45.000Z"
  },
  {
    "videoId": "G1cT0ELPV3U",
    "title": "\"Очікуваний Месія\" (Луки 2:21-35). Андрій Міщенко, 02.02.2025",
    "duration": 1547,
    "year": 2025,
    "formattedDate": "03 лютого 2025 року",
    "rawDate": "2025-02-03T06:53:39.000Z"
  },
  {
    "videoId": "iVUttiqBHvo",
    "title": "Служіння 2 лютого 2025 року",
    "duration": 7638,
    "year": 2025,
    "formattedDate": "02 лютого 2025 року",
    "rawDate": "2025-02-02T20:36:55.000Z"
  },
  {
    "videoId": "-pG3c9rfGf0",
    "title": "\"Темное небо, багровый закат\". Тимофей и Влад Охрименки, 26.01.2025",
    "duration": 220,
    "year": 2025,
    "formattedDate": "28 січня 2025 року",
    "rawDate": "2025-01-28T18:47:41.000Z"
  },
  {
    "videoId": "j8Cw8MLh1qo",
    "title": "Служіння 26 січня 2025 року",
    "duration": 7492,
    "year": 2025,
    "formattedDate": "28 січня 2025 року",
    "rawDate": "2025-01-28T18:43:10.000Z"
  },
  {
    "videoId": "qh3xsF6p-YQ",
    "title": "\"Не мир, но меч\" (Мтф 10:34-37). Сергей Комисар, 26.01.2025",
    "duration": 2895,
    "year": 2025,
    "formattedDate": "28 січня 2025 року",
    "rawDate": "2025-01-28T15:07:45.000Z"
  },
  {
    "videoId": "ieGWjaPWJXA",
    "title": "\"Огляд Євангелія від Матвія\". Віталій Зінченко, 26.01.2025",
    "duration": 1844,
    "year": 2025,
    "formattedDate": "28 січня 2025 року",
    "rawDate": "2025-01-28T12:14:36.000Z"
  },
  {
    "videoId": "rD9-PF7FHOs",
    "title": "Андрій Парфило, 19.01.2025",
    "duration": 2080,
    "year": 2025,
    "formattedDate": "19 січня 2025 року",
    "rawDate": "2025-01-19T19:41:44.000Z"
  },
  {
    "videoId": "PHyluzcELUU",
    "title": "\"4 елементи, потрібні для повної перемоги над дияволом\"(1Пет 5:8-11).Олександр Іванченко, 19.01.2025",
    "duration": 2061,
    "year": 2025,
    "formattedDate": "19 січня 2025 року",
    "rawDate": "2025-01-19T18:31:37.000Z"
  },
  {
    "videoId": "EyAtYa5rCa8",
    "title": "Служіння 19 січня 2025 року",
    "duration": 6640,
    "year": 2025,
    "formattedDate": "19 січня 2025 року",
    "rawDate": "2025-01-19T17:23:21.000Z"
  },
  {
    "videoId": "8VekodCNE2A",
    "title": "\"Скоро Я приду\". Тимофей и Влад Охрименки, 12.01.2025",
    "duration": 247,
    "year": 2025,
    "formattedDate": "18 січня 2025 року",
    "rawDate": "2025-01-18T07:50:36.000Z"
  },
  {
    "videoId": "DwjXFCZCv-U",
    "title": "\"НЕ клянись\" (Матвія 5:34-37). Микола Марйоха, 12.01.2025",
    "duration": 1776,
    "year": 2025,
    "formattedDate": "17 січня 2025 року",
    "rawDate": "2025-01-17T07:50:31.000Z"
  },
  {
    "videoId": "PsifFrIHBO8",
    "title": "\"Весілля Агнця. Христос на білому коні\" (Об'явлення 19:1-21). Віктор Лаба, 12.01.2025",
    "duration": 2793,
    "year": 2025,
    "formattedDate": "17 січня 2025 року",
    "rawDate": "2025-01-17T07:40:15.000Z"
  },
  {
    "videoId": "AS6-TPhilkA",
    "title": "Служіння 12 січня 2025 року",
    "duration": 6718,
    "year": 2025,
    "formattedDate": "12 січня 2025 року",
    "rawDate": "2025-01-12T21:58:20.000Z"
  },
  {
    "videoId": "d7N4FpfkqIw",
    "title": "\"Посланець Божий\" (Ін. 1:6). Андрій Булигін, 06.01.2025",
    "duration": 1666,
    "year": 2025,
    "formattedDate": "07 січня 2025 року",
    "rawDate": "2025-01-07T18:00:53.000Z"
  },
  {
    "videoId": "pu6xPYNAH9I",
    "title": "\"Обітниці Богу\" (Екл. 5:3-5). Юрій Коваленко, 06.01.2025",
    "duration": 711,
    "year": 2025,
    "formattedDate": "07 січня 2025 року",
    "rawDate": "2025-01-07T16:30:20.000Z"
  },
  {
    "videoId": "fLdgxNwHBRw",
    "title": "Служіння 6 січня 2025 року. Хрещення Господнє  (вечірнє зібрання)",
    "duration": 3707,
    "year": 2025,
    "formattedDate": "07 січня 2025 року",
    "rawDate": "2025-01-07T08:28:41.000Z"
  },
  {
    "videoId": "W79y_1pK9cg",
    "title": "\"Основи Євангельського священодійства водного хрещення\" (Мрк.1:9-11;1). Віктор Лаба, 06.01.2025",
    "duration": 2445,
    "year": 2025,
    "formattedDate": "07 січня 2025 року",
    "rawDate": "2025-01-06T22:23:41.000Z"
  },
  {
    "videoId": "IyrLwHAkLAk",
    "title": "Служіння  6 січня 2025 року. Хрещення Господнє",
    "duration": 2890,
    "year": 2025,
    "formattedDate": "06 січня 2025 року",
    "rawDate": "2025-01-06T20:22:40.000Z"
  },
  {
    "videoId": "jIyryj1aWG0",
    "title": "\"Останній крик Ісуса\" (Івана 19:28-30). Микола Марйоха, 05.01.2025",
    "duration": 1468,
    "year": 2025,
    "formattedDate": "05 січня 2025 року",
    "rawDate": "2025-01-05T19:29:55.000Z"
  },
  {
    "videoId": "poc2Rl9Q1kc",
    "title": "\"Влада прощати\" (Матвія 9:6-8). Андрій Міщенко, 05.01.2025",
    "duration": 1751,
    "year": 2025,
    "formattedDate": "05 січня 2025 року",
    "rawDate": "2025-01-05T19:03:20.000Z"
  },
  {
    "videoId": "5hBbgWZoAjg",
    "title": "\"Я жизнь отдал за тебя\". Влад и Тимофей Охрименки, 05.01.2025",
    "duration": 212,
    "year": 2025,
    "formattedDate": "05 січня 2025 року",
    "rawDate": "2025-01-05T17:46:01.000Z"
  },
  {
    "videoId": "bTVyGOZBQMQ",
    "title": "Служіння 5 січня 2025 року",
    "duration": 6443,
    "year": 2025,
    "formattedDate": "05 січня 2025 року",
    "rawDate": "2025-01-05T17:34:13.000Z"
  },
  {
    "videoId": "XtHvuGd5Ypk",
    "title": "\"Господи, йди з нами у новому році\" (Вихід 33:15-16). Микола Марйоха, 01.01.2024",
    "duration": 1096,
    "year": 2025,
    "formattedDate": "01 січня 2025 року",
    "rawDate": "2025-01-01T21:03:54.000Z"
  },
  {
    "videoId": "3DjW3UfOgfs",
    "title": "\"Не хлібом єдиним, буде жити людина, а всяким Словом...\"(Мтв. 4:4, Євр. 1:1).Віктор Лаба, 01.01.2025",
    "duration": 2572,
    "year": 2025,
    "formattedDate": "01 січня 2025 року",
    "rawDate": "2025-01-01T19:34:36.000Z"
  },
  {
    "videoId": "ZxhWh7Tcdrg",
    "title": "Служіння 1 січня 2025 року",
    "duration": 5561,
    "year": 2025,
    "formattedDate": "01 січня 2025 року",
    "rawDate": "2025-01-01T18:48:34.000Z"
  },
  {
    "videoId": "nRMGwqRjVho",
    "title": "\"Пам'ятай шлях, яким вів тебе Господь\" (Повтор. Закону 8:2). Микола Марйоха, 31.12.2024",
    "duration": 957,
    "year": 2025,
    "formattedDate": "01 січня 2025 року",
    "rawDate": "2025-01-01T16:40:05.000Z"
  },
  {
    "videoId": "NFc4u974Wz0",
    "title": "\"Сила молитви\" (Якова 5:13-20). Віталій Зінченко, 31.12.2024",
    "duration": 2538,
    "year": 2025,
    "formattedDate": "01 січня 2025 року",
    "rawDate": "2025-01-01T16:29:36.000Z"
  },
  {
    "videoId": "ai7YBV7LlgQ",
    "title": "Служіння 31 грудня 2024 року",
    "duration": 4964,
    "year": 2025,
    "formattedDate": "01 січня 2025 року",
    "rawDate": "2025-01-01T15:52:51.000Z"
  },
  {
    "videoId": "mgLed1qvVts",
    "title": "Служіння 29 грудня 2024 року",
    "duration": 6944,
    "year": 2024,
    "formattedDate": "31 грудня 2024 року",
    "rawDate": "2024-12-31T20:07:23.000Z"
  },
  {
    "videoId": "2nR7rDJQx8Y",
    "title": "\"Бог заради того, хто Він є чи Бог заради того, що Він дає?\" (Йова 1, 2:1-10).Андрій Парфило, 291224",
    "duration": 3234,
    "year": 2024,
    "formattedDate": "30 грудня 2024 року",
    "rawDate": "2024-12-29T23:28:06.000Z"
  },
  {
    "videoId": "kl374qTgxcY",
    "title": "\"\"Я есмь путь\"- как это?\" (Ин. 14:4-6). Сергей Комисар, 29.12.2024",
    "duration": 1834,
    "year": 2024,
    "formattedDate": "30 грудня 2024 року",
    "rawDate": "2024-12-29T22:08:16.000Z"
  },
  {
    "videoId": "R7jgsp6CWHo",
    "title": "\"Увіруйте в Христа\" (Івана 20:31). Михайло Пімоненко, 25.12.2024",
    "duration": 1824,
    "year": 2024,
    "formattedDate": "27 грудня 2024 року",
    "rawDate": "2024-12-27T13:42:00.000Z"
  },
  {
    "videoId": "Ctf7UsmCQeQ",
    "title": "\"Радість Різдва\" (Луки 2:7-14). Микола Марйоха, 25.12.2024",
    "duration": 834,
    "year": 2024,
    "formattedDate": "27 грудня 2024 року",
    "rawDate": "2024-12-27T13:26:49.000Z"
  },
  {
    "videoId": "Us1jRgluN84",
    "title": "\"Атрибути Царя!\" (Луки 2:1-7). Яків Деркач, 25.12.2024",
    "duration": 1103,
    "year": 2024,
    "formattedDate": "27 грудня 2024 року",
    "rawDate": "2024-12-27T12:57:03.000Z"
  },
  {
    "videoId": "JQeS46y962U",
    "title": "Загальноміське Різдвяне служіння 25.12.2024",
    "duration": 7962,
    "year": 2024,
    "formattedDate": "27 грудня 2024 року",
    "rawDate": "2024-12-27T07:31:42.000Z"
  },
  {
    "videoId": "oTX2rXssLj0",
    "title": "\"Володар миру\" (Іс. 9:6). Олександр Іванченко, 25.12.2024",
    "duration": 1295,
    "year": 2024,
    "formattedDate": "26 грудня 2024 року",
    "rawDate": "2024-12-26T16:35:51.000Z"
  },
  {
    "videoId": "ANhhbFOLPVU",
    "title": "\"...Син даний нам...\" (Іс. 9:6). Андрій Булигін, 25.12.2024",
    "duration": 2161,
    "year": 2024,
    "formattedDate": "26 грудня 2024 року",
    "rawDate": "2024-12-26T16:21:10.000Z"
  },
  {
    "videoId": "d5gZZMskcbs",
    "title": "Ранкове Різдвяне служіння 25.12.2024",
    "duration": 6502,
    "year": 2024,
    "formattedDate": "26 грудня 2024 року",
    "rawDate": "2024-12-26T07:53:53.000Z"
  },
  {
    "videoId": "R7z-tPPHNIY",
    "title": "Різдвяна вистава \"Червоні черевички на Різдво\", 24.12.2024",
    "duration": 1926,
    "year": 2024,
    "formattedDate": "26 грудня 2024 року",
    "rawDate": "2024-12-25T23:10:59.000Z"
  },
  {
    "videoId": "3VQ7_xKUgHo",
    "title": "Різдвяний дитячий хор 24.12.2024",
    "duration": 2903,
    "year": 2024,
    "formattedDate": "26 грудня 2024 року",
    "rawDate": "2024-12-25T22:32:22.000Z"
  },
  {
    "videoId": "c6VugvRhQpo",
    "title": "Різдвяна історіЯ. Дитячий хор. Різдвяна вистава (24.12.2025)",
    "duration": 5310,
    "year": 2024,
    "formattedDate": "26 грудня 2024 року",
    "rawDate": "2024-12-25T22:04:08.000Z"
  },
  {
    "videoId": "uj7SggiGDGk",
    "title": "\"Двері до Божої історії\" (Луки 2:7). Микола Марйоха, 22.12.2024",
    "duration": 1268,
    "year": 2024,
    "formattedDate": "22 грудня 2024 року",
    "rawDate": "2024-12-22T18:16:25.000Z"
  },
  {
    "videoId": "PjppDWFrtjk",
    "title": "\"Клятва і християнин\" (Якова 5:12). Віталій Зінченко, 22.12.2024",
    "duration": 1361,
    "year": 2024,
    "formattedDate": "22 грудня 2024 року",
    "rawDate": "2024-12-22T18:07:56.000Z"
  },
  {
    "videoId": "KoqE3Cgx_hk",
    "title": "Служіння 22 грудня 2024 року",
    "duration": 4271,
    "year": 2024,
    "formattedDate": "22 грудня 2024 року",
    "rawDate": "2024-12-22T17:36:22.000Z"
  },
  {
    "videoId": "IUztuRQ2b1g",
    "title": "\"Відлітають роки,мов птахи восени\". Влад та Тимофій Охріменки, 15.12.2024",
    "duration": 250,
    "year": 2024,
    "formattedDate": "16 грудня 2024 року",
    "rawDate": "2024-12-16T20:59:12.000Z"
  },
  {
    "videoId": "BBNGUEXmzpc",
    "title": "\"Три аспекти смирення\" (1Петра 5:5-7). Олександр Іванченко, 15.12.2024",
    "duration": 2436,
    "year": 2024,
    "formattedDate": "16 грудня 2024 року",
    "rawDate": "2024-12-16T06:59:46.000Z"
  },
  {
    "videoId": "QAaZHZxfOwc",
    "title": "\"Точні ваги або подвійні стандарти\" (Левит 19:35-36Андрій Булигін, 15.12.2024",
    "duration": 1480,
    "year": 2024,
    "formattedDate": "16 грудня 2024 року",
    "rawDate": "2024-12-15T22:14:47.000Z"
  },
  {
    "videoId": "jLoKzURMgRA",
    "title": "\"Служіння Господу через благовістя\". Віктор Косяк (м.Біла Церква), 15.12.2024",
    "duration": 1744,
    "year": 2024,
    "formattedDate": "16 грудня 2024 року",
    "rawDate": "2024-12-15T22:05:50.000Z"
  },
  {
    "videoId": "KjCvQbvaLg8",
    "title": "Служіння 15 грудня 2024 року",
    "duration": 8124,
    "year": 2024,
    "formattedDate": "15 грудня 2024 року",
    "rawDate": "2024-12-15T21:41:49.000Z"
  },
  {
    "videoId": "NHwAtRs9Zm8",
    "title": "\"Подивись, як лагідно і ніжно\" (08.12.2024)",
    "duration": 237,
    "year": 2024,
    "formattedDate": "09 грудня 2024 року",
    "rawDate": "2024-12-09T00:05:59.000Z"
  },
  {
    "videoId": "R-DxfjEDd50",
    "title": "\"Цінуй Царство Боже більше ніж гріховні задоволення\" (Матфія 5:27-32). Микола Марйоха 08.12.2024",
    "duration": 1827,
    "year": 2024,
    "formattedDate": "09 грудня 2024 року",
    "rawDate": "2024-12-08T23:22:10.000Z"
  },
  {
    "videoId": "8O8q4Bo5JcQ",
    "title": "\"Спокуса благополуччям нечестивих\" (Псалом 73). Андрій Міщенко 08 12 2024",
    "duration": 1606,
    "year": 2024,
    "formattedDate": "09 грудня 2024 року",
    "rawDate": "2024-12-08T22:56:55.000Z"
  },
  {
    "videoId": "32Ask5Xd4Zc",
    "title": "Благословіння Мирослави Авраменко 08 12 2024",
    "duration": 813,
    "year": 2024,
    "formattedDate": "09 грудня 2024 року",
    "rawDate": "2024-12-08T22:46:59.000Z"
  },
  {
    "videoId": "2jpkLHrt8qo",
    "title": "Служіння 8 грудня 2024 року",
    "duration": 5955,
    "year": 2024,
    "formattedDate": "09 грудня 2024 року",
    "rawDate": "2024-12-08T22:39:29.000Z"
  },
  {
    "videoId": "4ZFNFXnqMgA",
    "title": "Служіння 1 грудня 2024 року",
    "duration": 6046,
    "year": 2024,
    "formattedDate": "06 грудня 2024 року",
    "rawDate": "2024-12-05T23:12:30.000Z"
  },
  {
    "videoId": "N-2a0_lz4rw",
    "title": "\"Я дуже забажав спожити з вами цю Пасху\" (Луки 22:14-20). Микола Марйоха, 01.12.2024",
    "duration": 1069,
    "year": 2024,
    "formattedDate": "06 грудня 2024 року",
    "rawDate": "2024-12-05T22:19:49.000Z"
  },
  {
    "videoId": "pBkA_fZbYgk",
    "title": "\"Довготерпіння – ключовий елемент росту\" (Як. 5:7-11). Віталій Зінченко, 01.12.2024",
    "duration": 1865,
    "year": 2024,
    "formattedDate": "05 грудня 2024 року",
    "rawDate": "2024-12-05T21:42:33.000Z"
  },
  {
    "videoId": "vZy79A2PZnw",
    "title": "\"Гнів на брата - шлях до вбивства\" (Матф 5:21-26). Микола Марйоха, 24.11.2024",
    "duration": 1729,
    "year": 2024,
    "formattedDate": "28 листопада 2024 року",
    "rawDate": "2024-11-28T13:01:03.000Z"
  },
  {
    "videoId": "bNZpS2rH9Qk",
    "title": "\"Заблуждение и как обезопасить себя от него\" (2 Петра 3:17-18). Сергей Комисар, 24.11.2024",
    "duration": 2706,
    "year": 2024,
    "formattedDate": "26 листопада 2024 року",
    "rawDate": "2024-11-26T17:45:39.000Z"
  },
  {
    "videoId": "rA967n0hvGI",
    "title": "Служіння 24 листопада 2024 року",
    "duration": 6235,
    "year": 2024,
    "formattedDate": "24 листопада 2024 року",
    "rawDate": "2024-11-24T19:37:23.000Z"
  },
  {
    "videoId": "MOYhv2i6XAY",
    "title": "Служіння 17 листопада 2024 року",
    "duration": 7507,
    "year": 2024,
    "formattedDate": "23 листопада 2024 року",
    "rawDate": "2024-11-23T03:29:45.000Z"
  },
  {
    "videoId": "h-ZSgVuFS0g",
    "title": "Падіння Вавилону великого (Об'явлення 18). Віктор Лаба, 17.11.2024",
    "duration": 2340,
    "year": 2024,
    "formattedDate": "22 листопада 2024 року",
    "rawDate": "2024-11-22T18:57:46.000Z"
  },
  {
    "videoId": "oymUnPLtHR4",
    "title": "\"Урок від виноградної лози або взаємовідносини між віруючим та Христом\" (Ів. 15:1-8). Андрій Парфило",
    "duration": 2909,
    "year": 2024,
    "formattedDate": "22 листопада 2024 року",
    "rawDate": "2024-11-22T15:01:45.000Z"
  },
  {
    "videoId": "JJ2oI0AmkPk",
    "title": "\"Благодатное и подзаконное состояние\" (Осия 10:12).  Александр Кирсанов (г.Мариупооь), 10.11.2024",
    "duration": 2115,
    "year": 2024,
    "formattedDate": "12 листопада 2024 року",
    "rawDate": "2024-11-11T22:37:53.000Z"
  },
  {
    "videoId": "_kLYzZdlH5M",
    "title": "\"Церковь - дом Божий\" (1 Тим 3:14-15). Олег Кадацкий (г.Мариуполь), 10.11.2024",
    "duration": 1395,
    "year": 2024,
    "formattedDate": "11 листопада 2024 року",
    "rawDate": "2024-11-11T18:54:44.000Z"
  },
  {
    "videoId": "VKo5kd_je3A",
    "title": "Свидетельство брата Анатолия Ларченко (с.Кураховка, Покровский р-н., Донецкая обл.), 10.11.2024",
    "duration": 1161,
    "year": 2024,
    "formattedDate": "11 листопада 2024 року",
    "rawDate": "2024-11-11T17:31:57.000Z"
  },
  {
    "videoId": "3P9hTsFZomY",
    "title": "Благословіння Матвійчика Фоміна 10.11.2024",
    "duration": 503,
    "year": 2024,
    "formattedDate": "11 листопада 2024 року",
    "rawDate": "2024-11-11T13:35:42.000Z"
  },
  {
    "videoId": "ZT_aoRTpVfU",
    "title": "Служіння 10 листопада 2024 року",
    "duration": 7128,
    "year": 2024,
    "formattedDate": "11 листопада 2024 року",
    "rawDate": "2024-11-11T08:03:43.000Z"
  },
  {
    "videoId": "M90e5WRnfBA",
    "title": "\"Неоценненная Драгоценность\" (Ин. 3:31-36). Андрей Парфило, 03.11.2024",
    "duration": 2596,
    "year": 2024,
    "formattedDate": "03 листопада 2024 року",
    "rawDate": "2024-11-03T18:27:07.000Z"
  },
  {
    "videoId": "WvtTSSwh7-E",
    "title": "Служіння 3 листопада 2024 року",
    "duration": 5613,
    "year": 2024,
    "formattedDate": "03 листопада 2024 року",
    "rawDate": "2024-11-03T17:36:17.000Z"
  },
  {
    "videoId": "s-S34zQPSTw",
    "title": "\"Життя коротке: одна надія - Ісус\" (Екклезіяст 7:1-4). Андрій Булигін, 27.10.2024",
    "duration": 2398,
    "year": 2024,
    "formattedDate": "01 листопада 2024 року",
    "rawDate": "2024-11-01T18:02:52.000Z"
  },
  {
    "videoId": "0Vcs5Dh9VbE",
    "title": "\"Шлях відновлення стосунків з Богом\" (Псалом 51). Андрій Міщенко, 27.10.2024",
    "duration": 1501,
    "year": 2024,
    "formattedDate": "01 листопада 2024 року",
    "rawDate": "2024-11-01T16:59:40.000Z"
  },
  {
    "videoId": "_JSpr-542qE",
    "title": "Служіння 27 жовтня 2024",
    "duration": 6657,
    "year": 2024,
    "formattedDate": "01 листопада 2024 року",
    "rawDate": "2024-11-01T16:04:28.000Z"
  },
  {
    "videoId": "uuoMg8K_1GM",
    "title": "Служіння хору 27.10.2024",
    "duration": 561,
    "year": 2024,
    "formattedDate": "31 жовтня 2024 року",
    "rawDate": "2024-10-31T05:42:12.000Z"
  },
  {
    "videoId": "haafCkthphk",
    "title": "Служіння 27 жовтня 2024 року",
    "duration": 6657,
    "year": 2024,
    "formattedDate": "28 жовтня 2024 року",
    "rawDate": "2024-10-28T07:59:19.000Z"
  },
  {
    "videoId": "btNFC-G98Y0",
    "title": "\"Праведність вища за фарисейську\" (Матв 5:20). Микола Марйоха, 20.10.2024",
    "duration": 2273,
    "year": 2024,
    "formattedDate": "21 жовтня 2024 року",
    "rawDate": "2024-10-21T00:30:16.000Z"
  },
  {
    "videoId": "OuSFIlYOw3I",
    "title": "\"Як не збочити по дорозі до вічності?\" (2 Пет 1:3-11). Андрій Парфило,20.10.2024",
    "duration": 2421,
    "year": 2024,
    "formattedDate": "21 жовтня 2024 року",
    "rawDate": "2024-10-20T23:13:28.000Z"
  },
  {
    "videoId": "dnSqLPtuMYw",
    "title": "Служіння хору 20 жовтня 2024 року",
    "duration": 545,
    "year": 2024,
    "formattedDate": "21 жовтня 2024 року",
    "rawDate": "2024-10-20T22:04:53.000Z"
  },
  {
    "videoId": "CnrEr4IA0J0",
    "title": "Прославлення Господа 20 жовтня 2024 року",
    "duration": 1614,
    "year": 2024,
    "formattedDate": "21 жовтня 2024 року",
    "rawDate": "2024-10-20T21:46:14.000Z"
  },
  {
    "videoId": "KnLCJ7SSpJc",
    "title": "Служіння 20 жовтня 2024 року",
    "duration": 7013,
    "year": 2024,
    "formattedDate": "20 жовтня 2024 року",
    "rawDate": "2024-10-20T17:55:10.000Z"
  },
  {
    "videoId": "B4HZYT215lY",
    "title": "Служіння хору 13 жовтня 2024",
    "duration": 776,
    "year": 2024,
    "formattedDate": "17 жовтня 2024 року",
    "rawDate": "2024-10-17T04:51:59.000Z"
  },
  {
    "videoId": "ae1xhJjJQTE",
    "title": "Прославлення Господа 13 жовтня 2024 року",
    "duration": 2067,
    "year": 2024,
    "formattedDate": "17 жовтня 2024 року",
    "rawDate": "2024-10-16T22:16:45.000Z"
  },
  {
    "videoId": "E0ZGJo9494k",
    "title": "\"Не преврати спасение в погибель\" ( 2 Пет 3:15-16). Сергей Комисар, 13.10.2024",
    "duration": 2402,
    "year": 2024,
    "formattedDate": "16 жовтня 2024 року",
    "rawDate": "2024-10-16T20:49:19.000Z"
  },
  {
    "videoId": "vTmTc2nAq6c",
    "title": "\"Відношення до грошей\" (Якова 5:1-6). Віталій Зінченко, 13.10.2024",
    "duration": 1739,
    "year": 2024,
    "formattedDate": "16 жовтня 2024 року",
    "rawDate": "2024-10-16T19:29:30.000Z"
  },
  {
    "videoId": "R3bVPanyTPQ",
    "title": "Служіння 13 жовтня 2024 року",
    "duration": 7809,
    "year": 2024,
    "formattedDate": "15 жовтня 2024 року",
    "rawDate": "2024-10-15T20:32:07.000Z"
  },
  {
    "videoId": "eWuxRmChP1U",
    "title": "Служіння хору 06.10.2024",
    "duration": 611,
    "year": 2024,
    "formattedDate": "07 жовтня 2024 року",
    "rawDate": "2024-10-07T07:31:02.000Z"
  },
  {
    "videoId": "nyrvvQOb-14",
    "title": "Прославлення Господа 06 жовтня 2024",
    "duration": 2567,
    "year": 2024,
    "formattedDate": "07 жовтня 2024 року",
    "rawDate": "2024-10-07T06:24:32.000Z"
  },
  {
    "videoId": "G91KBCi4WIY",
    "title": "\"Христос - наш Учитель (Матвія 28:19-20). Микола Марйоха, 06.10.2024",
    "duration": 1342,
    "year": 2024,
    "formattedDate": "07 жовтня 2024 року",
    "rawDate": "2024-10-07T05:14:19.000Z"
  },
  {
    "videoId": "C9JvN8QqBu0",
    "title": "'Глибина людської гріховності, висота Божої милості\" (2 Хронік 3:1-17). Андрій Парфило, 06.10.2024",
    "duration": 2430,
    "year": 2024,
    "formattedDate": "07 жовтня 2024 року",
    "rawDate": "2024-10-07T05:00:44.000Z"
  },
  {
    "videoId": "ZEja_l82CZY",
    "title": "Служіння 6 жовтня 2024 року",
    "duration": 7621,
    "year": 2024,
    "formattedDate": "07 жовтня 2024 року",
    "rawDate": "2024-10-06T23:21:44.000Z"
  },
  {
    "videoId": "XZoo5xR0QME",
    "title": "\"Жнива\" (Вихід 23;16-17; Второзаконня 8:10-11). Сергій Мазур, 29.09.2024",
    "duration": 2420,
    "year": 2024,
    "formattedDate": "30 вересня 2024 року",
    "rawDate": "2024-09-30T04:43:39.000Z"
  },
  {
    "videoId": "TpEbupnrkt8",
    "title": "\"Вдячність Господу\" (Псалом 67:6-8). Микола Марйоха, 29.09.2024",
    "duration": 1555,
    "year": 2024,
    "formattedDate": "30 вересня 2024 року",
    "rawDate": "2024-09-29T23:57:29.000Z"
  },
  {
    "videoId": "chRcNKW6Zxw",
    "title": "Служіння хору 29.09.2024. День Подяки",
    "duration": 811,
    "year": 2024,
    "formattedDate": "30 вересня 2024 року",
    "rawDate": "2024-09-29T21:40:23.000Z"
  },
  {
    "videoId": "Ldey_nBCCjA",
    "title": "Прославлення Господа 29.09.2024. День Подяки",
    "duration": 3285,
    "year": 2024,
    "formattedDate": "30 вересня 2024 року",
    "rawDate": "2024-09-29T21:34:32.000Z"
  },
  {
    "videoId": "EXwbOdj7BYM",
    "title": "Служіння 29 вересня 2024 року. День Подяки Господу",
    "duration": 8155,
    "year": 2024,
    "formattedDate": "30 вересня 2024 року",
    "rawDate": "2024-09-29T21:02:14.000Z"
  },
  {
    "videoId": "L7MfRt3adok",
    "title": "\"Я раньше никогда не замечала\". Наталия Таран (г.Харьков), 29.09.2024",
    "duration": 295,
    "year": 2024,
    "formattedDate": "29 вересня 2024 року",
    "rawDate": "2024-09-29T15:17:25.000Z"
  },
  {
    "videoId": "HNM6GR7lj5E",
    "title": "\"Осінь, осінь...Листя пожовтіло\". Хор, 22.09.2024",
    "duration": 187,
    "year": 2024,
    "formattedDate": "23 вересня 2024 року",
    "rawDate": "2024-09-23T05:27:06.000Z"
  },
  {
    "videoId": "oqSx3tGMF74",
    "title": "\"Да святится, о Господи, Имя Твое\". Тимофей и Влад Охрименки, 22.09.2024",
    "duration": 273,
    "year": 2024,
    "formattedDate": "23 вересня 2024 року",
    "rawDate": "2024-09-23T04:38:02.000Z"
  },
  {
    "videoId": "Au8Xgf_y6Jk",
    "title": "\"Як будувати плани на майбутнє\" (Як. 4:13-17). Віталій Зінченко, 22.09.2024",
    "duration": 1125,
    "year": 2024,
    "formattedDate": "22 вересня 2024 року",
    "rawDate": "2024-09-22T19:18:08.000Z"
  },
  {
    "videoId": "5X0JA4Gc__k",
    "title": "\"Властивості любові\" (1 Кор. 13:1-8). Андрій Міщенко, 22.09.2024",
    "duration": 1603,
    "year": 2024,
    "formattedDate": "22 вересня 2024 року",
    "rawDate": "2024-09-22T19:09:05.000Z"
  },
  {
    "videoId": "EPi6RVaC-bA",
    "title": "Служіння хору 22.09.2024",
    "duration": 638,
    "year": 2024,
    "formattedDate": "22 вересня 2024 року",
    "rawDate": "2024-09-22T18:53:57.000Z"
  },
  {
    "videoId": "p0VnH_ABH2o",
    "title": "Прославлення Господа 22.09.2024",
    "duration": 1970,
    "year": 2024,
    "formattedDate": "22 вересня 2024 року",
    "rawDate": "2024-09-22T18:45:01.000Z"
  },
  {
    "videoId": "deZ45uZ8CIY",
    "title": "Служіння 22 вересня 2024 року",
    "duration": 5799,
    "year": 2024,
    "formattedDate": "22 вересня 2024 року",
    "rawDate": "2024-09-22T15:20:54.000Z"
  },
  {
    "videoId": "rXByQnW-aTQ",
    "title": "\"Ходимо вірою\" (2 Кор. 5:7). Андрій Булигін, 15.09.2024",
    "duration": 1611,
    "year": 2024,
    "formattedDate": "18 вересня 2024 року",
    "rawDate": "2024-09-17T21:05:34.000Z"
  },
  {
    "videoId": "iSYPW9vTPPY",
    "title": "\"Надія\" (Римлян 15:13). Микола Марйоха, 15.09.2024",
    "duration": 236,
    "year": 2024,
    "formattedDate": "15 вересня 2024 року",
    "rawDate": "2024-09-15T19:44:09.000Z"
  },
  {
    "videoId": "jlMGXvjL70Q",
    "title": "\"Три аспекти необхідні для ефективного служіння\" (1 Петра 5:1-4). Олександр Іванченко, 15.09.2024",
    "duration": 2210,
    "year": 2024,
    "formattedDate": "15 вересня 2024 року",
    "rawDate": "2024-09-15T19:37:39.000Z"
  },
  {
    "videoId": "xdTJEhyU1WM",
    "title": "Служіння хору 15.09.2024",
    "duration": 489,
    "year": 2024,
    "formattedDate": "15 вересня 2024 року",
    "rawDate": "2024-09-15T18:41:39.000Z"
  },
  {
    "videoId": "OmJsirNz-1M",
    "title": "Прославлення Господа 15.09.2024",
    "duration": 1556,
    "year": 2024,
    "formattedDate": "15 вересня 2024 року",
    "rawDate": "2024-09-15T18:36:10.000Z"
  },
  {
    "videoId": "3gUwAJ-LAV8",
    "title": "Служіння 15 вересня 2024",
    "duration": 6610,
    "year": 2024,
    "formattedDate": "15 вересня 2024 року",
    "rawDate": "2024-09-15T18:19:52.000Z"
  },
  {
    "videoId": "-_tQUHW9toE",
    "title": "\"Инструменты для духовного роста\". Андрей Парфило, 08.09.2024",
    "duration": 2338,
    "year": 2024,
    "formattedDate": "09 вересня 2024 року",
    "rawDate": "2024-09-09T10:47:55.000Z"
  },
  {
    "videoId": "9JfhRxP5Ass",
    "title": "\"Сохрани Его чистоту\" (2 Петра 3:14). Сергей Комисар, 08.09.2024",
    "duration": 2132,
    "year": 2024,
    "formattedDate": "09 вересня 2024 року",
    "rawDate": "2024-09-09T07:36:50.000Z"
  },
  {
    "videoId": "WSIEzBXOux0",
    "title": "Служіння хору 08.09.2024",
    "duration": 534,
    "year": 2024,
    "formattedDate": "09 вересня 2024 року",
    "rawDate": "2024-09-09T03:58:59.000Z"
  },
  {
    "videoId": "BD5S_NJzJAU",
    "title": "Прославлення Господа 08 вересня 2024 року",
    "duration": 1360,
    "year": 2024,
    "formattedDate": "09 вересня 2024 року",
    "rawDate": "2024-09-09T02:01:56.000Z"
  },
  {
    "videoId": "1YVbkqJ3YQY",
    "title": "Служіння 08 вересня 2024 року",
    "duration": 6689,
    "year": 2024,
    "formattedDate": "08 вересня 2024 року",
    "rawDate": "2024-09-08T20:21:52.000Z"
  },
  {
    "videoId": "N6UJVMTb1Oc",
    "title": "\"Перемога Ісуса Христа\" (2 Коринтян 2:14). Микола Марйоха, 01.09.2024",
    "duration": 883,
    "year": 2024,
    "formattedDate": "04 вересня 2024 року",
    "rawDate": "2024-09-04T19:24:52.000Z"
  },
  {
    "videoId": "6i0v-ivsEgQ",
    "title": "\" Поради на новий навчальний рік\" (Притчі 4:5-15). Віталій Зінченко, 01.09.2024",
    "duration": 1811,
    "year": 2024,
    "formattedDate": "04 вересня 2024 року",
    "rawDate": "2024-09-04T12:49:29.000Z"
  },
  {
    "videoId": "hJbh4V7WeD4",
    "title": "Служіння хору 01.09.2024",
    "duration": 721,
    "year": 2024,
    "formattedDate": "04 вересня 2024 року",
    "rawDate": "2024-09-04T07:27:22.000Z"
  },
  {
    "videoId": "30ztGd_rLl4",
    "title": "Прославлення Господа 01.09.2024",
    "duration": 2046,
    "year": 2024,
    "formattedDate": "04 вересня 2024 року",
    "rawDate": "2024-09-04T07:14:48.000Z"
  },
  {
    "videoId": "HRcyAgDOIO8",
    "title": "Служіння 01 вересня 2024 року",
    "duration": 6579,
    "year": 2024,
    "formattedDate": "04 вересня 2024 року",
    "rawDate": "2024-09-04T01:29:06.000Z"
  },
  {
    "videoId": "VX7p1XQuVgs",
    "title": "\"Подивись, як лагідно і ніжно\". Служіння хору, 25.08.2024",
    "duration": 239,
    "year": 2024,
    "formattedDate": "27 серпня 2024 року",
    "rawDate": "2024-08-27T14:17:01.000Z"
  },
  {
    "videoId": "kKFHBtn7gX4",
    "title": "Служіння хору 25.08.2024",
    "duration": 635,
    "year": 2024,
    "formattedDate": "27 серпня 2024 року",
    "rawDate": "2024-08-27T07:58:49.000Z"
  },
  {
    "videoId": "qwrWYIsYBNM",
    "title": "Прославлення Господа 25.08.2024",
    "duration": 2153,
    "year": 2024,
    "formattedDate": "27 серпня 2024 року",
    "rawDate": "2024-08-27T07:48:41.000Z"
  },
  {
    "videoId": "yeRP8xyfxLY",
    "title": "\"Єзекія і обмежений час\" (Ісаї 38:1-3). Андрій Булигін, 25.08.2024",
    "duration": 1893,
    "year": 2024,
    "formattedDate": "27 серпня 2024 року",
    "rawDate": "2024-08-27T07:28:30.000Z"
  },
  {
    "videoId": "4-3Z01wdz4s",
    "title": "\"Вавилон: таємниця жінки та звіра\" (Об'явлення 17). Віктор Лаба, 25.08.2024",
    "duration": 2411,
    "year": 2024,
    "formattedDate": "27 серпня 2024 року",
    "rawDate": "2024-08-27T01:51:33.000Z"
  },
  {
    "videoId": "nYlDdF5w-g0",
    "title": "\"Ми вічнії з тобою\". Тимофій та Влад Охріменки, 25.08.2024",
    "duration": 258,
    "year": 2024,
    "formattedDate": "27 серпня 2024 року",
    "rawDate": "2024-08-27T01:25:40.000Z"
  },
  {
    "videoId": "T9whSeuEG9c",
    "title": "Служіння 25 серпня 2024 року",
    "duration": 7247,
    "year": 2024,
    "formattedDate": "26 серпня 2024 року",
    "rawDate": "2024-08-26T09:37:47.000Z"
  },
  {
    "videoId": "uFC2WUt8ZCM",
    "title": "Служіння хору 18 серпня 2024 року",
    "duration": 369,
    "year": 2024,
    "formattedDate": "19 серпня 2024 року",
    "rawDate": "2024-08-19T10:25:08.000Z"
  },
  {
    "videoId": "gakg8t7SmpY",
    "title": "Прославлення Господа 18 серпня 2024 року",
    "duration": 1342,
    "year": 2024,
    "formattedDate": "19 серпня 2024 року",
    "rawDate": "2024-08-19T09:50:17.000Z"
  },
  {
    "videoId": "gv9T4fwjyKk",
    "title": "\"Обрезание сердца\" (Иисус Навин 5:13-15). Александр Кирсанов (г.Мариуполь), 18.08.2024",
    "duration": 1768,
    "year": 2024,
    "formattedDate": "19 серпня 2024 року",
    "rawDate": "2024-08-19T09:44:35.000Z"
  },
  {
    "videoId": "bnr7hC6zLcY",
    "title": "Свідоцтво та прославлення Господа. Валентин Малінов (с.Світязь, Волинська обл.), 18.08.2024",
    "duration": 530,
    "year": 2024,
    "formattedDate": "19 серпня 2024 року",
    "rawDate": "2024-08-19T08:36:05.000Z"
  },
  {
    "videoId": "JEwFNKhdeiQ",
    "title": "Свидетельство Сергея Осипова (г.Мариуполь), 18.08.2024",
    "duration": 1282,
    "year": 2024,
    "formattedDate": "19 серпня 2024 року",
    "rawDate": "2024-08-19T08:18:44.000Z"
  },
  {
    "videoId": "PFexPhJPriE",
    "title": "\"Если все разрушиться,то какими должно быть вам\" (2 Петра 3:10-12). Сергей Комисар, 18.08.2024",
    "duration": 2544,
    "year": 2024,
    "formattedDate": "19 серпня 2024 року",
    "rawDate": "2024-08-19T07:57:28.000Z"
  },
  {
    "videoId": "74hta54tAcA",
    "title": "Служіння 18 серпня 2024 року",
    "duration": 7747,
    "year": 2024,
    "formattedDate": "19 серпня 2024 року",
    "rawDate": "2024-08-19T06:29:44.000Z"
  },
  {
    "videoId": "3gwDVPtNSq0",
    "title": "Служіння хору 11 серпня 2024 року",
    "duration": 549,
    "year": 2024,
    "formattedDate": "13 серпня 2024 року",
    "rawDate": "2024-08-13T13:15:41.000Z"
  },
  {
    "videoId": "_1Vvpb0aIC8",
    "title": "Прославлення Господа 11.08.2024",
    "duration": 1526,
    "year": 2024,
    "formattedDate": "13 серпня 2024 року",
    "rawDate": "2024-08-13T12:54:16.000Z"
  },
  {
    "videoId": "tZ4lpUq-NP4",
    "title": "\"Как увидеть Божий смысл в происходящих событиях\" (2 Петра 3:1-9). Сергей Комисар, 11.08.2024",
    "duration": 2857,
    "year": 2024,
    "formattedDate": "13 серпня 2024 року",
    "rawDate": "2024-08-13T12:13:54.000Z"
  },
  {
    "videoId": "aFeMwPoiEY4",
    "title": "\"Милості хочу, а не жертви\" (Матвія 9:9-13). Андрій Міщенко, 11.08.2024",
    "duration": 2045,
    "year": 2024,
    "formattedDate": "13 серпня 2024 року",
    "rawDate": "2024-08-13T09:58:05.000Z"
  },
  {
    "videoId": "NOYc77VyBAc",
    "title": "Служіння 11 серпня 2024 року",
    "duration": 7055,
    "year": 2024,
    "formattedDate": "13 серпня 2024 року",
    "rawDate": "2024-08-13T08:12:59.000Z"
  },
  {
    "videoId": "DapxTapDr_A",
    "title": "Служіння хору 04.08.2024",
    "duration": 740,
    "year": 2024,
    "formattedDate": "09 серпня 2024 року",
    "rawDate": "2024-08-08T22:16:57.000Z"
  },
  {
    "videoId": "BRL0cbJoUC8",
    "title": "Прославлення Господа 4 серпня 2024 року",
    "duration": 1561,
    "year": 2024,
    "formattedDate": "09 серпня 2024 року",
    "rawDate": "2024-08-08T21:12:30.000Z"
  },
  {
    "videoId": "oqN2mYbPQSE",
    "title": "\"Мир Мій\" (Ів. 14:27). Микола Марйоха, 04.08.2024",
    "duration": 1209,
    "year": 2024,
    "formattedDate": "08 серпня 2024 року",
    "rawDate": "2024-08-08T16:45:31.000Z"
  },
  {
    "videoId": "MHSibjON5MY",
    "title": "\"Чаша Господня vs чаша демонів\" (1 Кор. 10). Андрій Булигін, 04.08.2024",
    "duration": 1899,
    "year": 2024,
    "formattedDate": "08 серпня 2024 року",
    "rawDate": "2024-08-08T13:35:28.000Z"
  },
  {
    "videoId": "_1nN6Qjopxc",
    "title": "Служіння 4 серпня 2024 року",
    "duration": 6470,
    "year": 2024,
    "formattedDate": "08 серпня 2024 року",
    "rawDate": "2024-08-08T06:52:41.000Z"
  },
  {
    "videoId": "FGRmbocFatY",
    "title": "\"Як нам увійти у славу Божу?\". Фрагмент проповіді Віктора Лаби, 06.07.2024",
    "duration": 883,
    "year": 2024,
    "formattedDate": "06 серпня 2024 року",
    "rawDate": "2024-08-06T11:28:19.000Z"
  },
  {
    "videoId": "riDvf85z3M4",
    "title": "\"Вірю я в обітниці Христа\", 06.07.2024",
    "duration": 171,
    "year": 2024,
    "formattedDate": "06 серпня 2024 року",
    "rawDate": "2024-08-06T06:55:05.000Z"
  },
  {
    "videoId": "mZIrKkXhGS4",
    "title": "Благословіння дітей - Єлизавети Міщенко та Марії Іванченко (28.07.2024)",
    "duration": 1977,
    "year": 2024,
    "formattedDate": "29 липня 2024 року",
    "rawDate": "2024-07-29T09:59:20.000Z"
  },
  {
    "videoId": "EKazVoQeOzQ",
    "title": "\"Ничего мой Господь не хочу без Тебя\". Влад Охрименко, 28.07.2024",
    "duration": 254,
    "year": 2024,
    "formattedDate": "28 липня 2024 року",
    "rawDate": "2024-07-28T20:15:50.000Z"
  },
  {
    "videoId": "7F7e_lLROgg",
    "title": "Служіння хору 28 липня 2024 року",
    "duration": 778,
    "year": 2024,
    "formattedDate": "28 липня 2024 року",
    "rawDate": "2024-07-28T19:32:34.000Z"
  },
  {
    "videoId": "z_lsdsqfRkk",
    "title": "Прославлення Господа 28 липня 2024 року",
    "duration": 1795,
    "year": 2024,
    "formattedDate": "28 липня 2024 року",
    "rawDate": "2024-07-28T19:21:39.000Z"
  },
  {
    "videoId": "bL7AtEXJ2fY",
    "title": "\"Не осуджувати, а любити\" (Як. 4:11-12). Віталій Зінченко, 28.07.2024",
    "duration": 1202,
    "year": 2024,
    "formattedDate": "28 липня 2024 року",
    "rawDate": "2024-07-28T18:41:03.000Z"
  },
  {
    "videoId": "RaaAHY3uj_E",
    "title": "Служіння 28 липня 2024 року",
    "duration": 5441,
    "year": 2024,
    "formattedDate": "28 липня 2024 року",
    "rawDate": "2024-07-28T13:56:39.000Z"
  },
  {
    "videoId": "7cWqkPu9fWs",
    "title": "\"Бачу Бога кожен день\". Хор церкви \"Дім Євангелія\" (м.Суми, 21.07.2024)",
    "duration": 285,
    "year": 2024,
    "formattedDate": "22 липня 2024 року",
    "rawDate": "2024-07-22T08:52:12.000Z"
  },
  {
    "videoId": "57FGY5tuDHE",
    "title": "\"Я прийшов не відмінити, а виконати Закон\" (Матвія 5:1-18). Микола Марйоха, 21.07.2024",
    "duration": 2090,
    "year": 2024,
    "formattedDate": "21 липня 2024 року",
    "rawDate": "2024-07-21T20:16:03.000Z"
  },
  {
    "videoId": "roOPDG3Bsmw",
    "title": "Служіння хору 21 липня 2024 року",
    "duration": 514,
    "year": 2024,
    "formattedDate": "21 липня 2024 року",
    "rawDate": "2024-07-21T20:14:26.000Z"
  },
  {
    "videoId": "YLPzkkK5iTM",
    "title": "Прославлення Господа 21 липня 2024 року",
    "duration": 1360,
    "year": 2024,
    "formattedDate": "21 липня 2024 року",
    "rawDate": "2024-07-21T17:15:41.000Z"
  },
  {
    "videoId": "MnB2laSNcBA",
    "title": "\"Полная преданность или то, что ценно в Божьих глазах\" (2 Пар 16:9). Андрей Парфило, 21.07.2024",
    "duration": 2423,
    "year": 2024,
    "formattedDate": "21 липня 2024 року",
    "rawDate": "2024-07-21T15:11:48.000Z"
  },
  {
    "videoId": "ifYA0s5cIkc",
    "title": "Служіння 21 липня 2024 року",
    "duration": 6611,
    "year": 2024,
    "formattedDate": "21 липня 2024 року",
    "rawDate": "2024-07-21T14:42:06.000Z"
  },
  {
    "videoId": "_66dcKQx1i0",
    "title": "\"Буду вірним\". Хор церкви \"Дім Євангелія\", 14.07.2024",
    "duration": 221,
    "year": 2024,
    "formattedDate": "19 липня 2024 року",
    "rawDate": "2024-07-19T01:03:19.000Z"
  },
  {
    "videoId": "wv8accU6MQA",
    "title": "\"Жены, повинуйтесь своим мужьям\" (1 Петра 3:1-6). Сергей Комисар,14.07.2024",
    "duration": 2693,
    "year": 2024,
    "formattedDate": "17 липня 2024 року",
    "rawDate": "2024-07-17T09:42:24.000Z"
  },
  {
    "videoId": "kE5YKHzZ4Ms",
    "title": "Служіння хору 14 липня 2024",
    "duration": 517,
    "year": 2024,
    "formattedDate": "17 липня 2024 року",
    "rawDate": "2024-07-17T04:54:04.000Z"
  },
  {
    "videoId": "RcqT3NtQGtc",
    "title": "Прославлення Господа 14 липня 2024 року",
    "duration": 1241,
    "year": 2024,
    "formattedDate": "17 липня 2024 року",
    "rawDate": "2024-07-17T04:52:04.000Z"
  },
  {
    "videoId": "Uj5KmfW_vZM",
    "title": "\"Невірний нехай стане вірним\" (Якова 4:4-10). Віталій Зінченко, 14.07.2024",
    "duration": 2429,
    "year": 2024,
    "formattedDate": "17 липня 2024 року",
    "rawDate": "2024-07-17T04:41:26.000Z"
  },
  {
    "videoId": "s7FZnlTQplI",
    "title": "Служіння 14 липня 2024 року",
    "duration": 7515,
    "year": 2024,
    "formattedDate": "17 липня 2024 року",
    "rawDate": "2024-07-17T04:12:11.000Z"
  },
  {
    "videoId": "YG_eXHOupu8",
    "title": "\"Величному\". Хор церкви \"Дім Євангелія\" (м.Суми)",
    "duration": 249,
    "year": 2024,
    "formattedDate": "11 липня 2024 року",
    "rawDate": "2024-07-11T12:41:01.000Z"
  },
  {
    "videoId": "CTxvrxS2ZNk",
    "title": "\"Ты - единственный, Кто знает моё сердце\". Песня на языке жестов (07.07.2024)",
    "duration": 241,
    "year": 2024,
    "formattedDate": "11 липня 2024 року",
    "rawDate": "2024-07-11T12:10:26.000Z"
  },
  {
    "videoId": "e1ZDR47kfco",
    "title": "Служіння хору 07.07.2024",
    "duration": 1101,
    "year": 2024,
    "formattedDate": "11 липня 2024 року",
    "rawDate": "2024-07-10T21:12:20.000Z"
  },
  {
    "videoId": "elxiHfzqUVs",
    "title": "Прославлення Господа 07.07.2024 року",
    "duration": 2451,
    "year": 2024,
    "formattedDate": "10 липня 2024 року",
    "rawDate": "2024-07-10T20:48:45.000Z"
  },
  {
    "videoId": "sQIrP3V0_s0",
    "title": "Водне Хрещення. Служіння 07.07.2024",
    "duration": 5897,
    "year": 2024,
    "formattedDate": "10 липня 2024 року",
    "rawDate": "2024-07-10T12:17:58.000Z"
  },
  {
    "videoId": "JoJLdv0sE4s",
    "title": "\"Пам'ятай день цей\" (1 Кор 11:23-26). Микола Павлович, 07.07.2024",
    "duration": 1229,
    "year": 2024,
    "formattedDate": "09 липня 2024 року",
    "rawDate": "2024-07-09T20:04:22.000Z"
  },
  {
    "videoId": "nQjVogmUVKU",
    "title": "Водне Хрещення 7 липня 2024 року",
    "duration": 3539,
    "year": 2024,
    "formattedDate": "07 липня 2024 року",
    "rawDate": "2024-07-07T20:46:41.000Z"
  },
  {
    "videoId": "ZdsfiBH9tKE",
    "title": "Служіння 29 червня 2024 року",
    "duration": 6847,
    "year": 2024,
    "formattedDate": "06 липня 2024 року",
    "rawDate": "2024-07-06T20:03:43.000Z"
  },
  {
    "videoId": "rr-BGU2Y_mQ",
    "title": "Християнський сімейний уїкенд (29.06.2024)",
    "duration": 2631,
    "year": 2024,
    "formattedDate": "05 липня 2024 року",
    "rawDate": "2024-07-05T15:57:03.000Z"
  },
  {
    "videoId": "W7uV51_4Uvw",
    "title": "Служіння хору 30 червня 2024 року",
    "duration": 513,
    "year": 2024,
    "formattedDate": "02 липня 2024 року",
    "rawDate": "2024-07-02T11:07:36.000Z"
  },
  {
    "videoId": "0ZFkLgedtvs",
    "title": "Прославлення Господа 30 червня 2024 року",
    "duration": 1713,
    "year": 2024,
    "formattedDate": "02 липня 2024 року",
    "rawDate": "2024-07-02T09:29:36.000Z"
  },
  {
    "videoId": "Kyw6jaIeri8",
    "title": "\"Два заклики до церкви та її пастирів\" (Тит 1:1-9). Артем Бакаєв, 30.06.2024",
    "duration": 1993,
    "year": 2024,
    "formattedDate": "02 липня 2024 року",
    "rawDate": "2024-07-02T06:31:52.000Z"
  },
  {
    "videoId": "xslt7tuzPa4",
    "title": "\"Богоугодна молитва\" ( 1 Тим 2:1-8). Андрій Міщенко, 30.06.2024",
    "duration": 1750,
    "year": 2024,
    "formattedDate": "01 липня 2024 року",
    "rawDate": "2024-07-01T19:27:32.000Z"
  },
  {
    "videoId": "PQywLUPErug",
    "title": "\"Бог - мій Творець\". Співають діти, 30.06.2024",
    "duration": 326,
    "year": 2024,
    "formattedDate": "30 червня 2024 року",
    "rawDate": "2024-06-30T13:34:54.000Z"
  },
  {
    "videoId": "eIWrzVaB4pg",
    "title": "\"Какая польза от страданий?\" (1Пет 4:1,12; 1 Пет 5:10). Сергей Комисар, 23.06.2024",
    "duration": 2570,
    "year": 2024,
    "formattedDate": "24 червня 2024 року",
    "rawDate": "2024-06-24T15:08:47.000Z"
  },
  {
    "videoId": "X541cYJCfic",
    "title": "\"Тщетен труд без Божьего благословения\" (Псалом 126). Юрий Коваленко, 23.06.2024",
    "duration": 842,
    "year": 2024,
    "formattedDate": "24 червня 2024 року",
    "rawDate": "2024-06-24T08:17:30.000Z"
  },
  {
    "videoId": "Vv3qEt9Hip8",
    "title": "Служіння хору 23 червня 2024 року",
    "duration": 515,
    "year": 2024,
    "formattedDate": "24 червня 2024 року",
    "rawDate": "2024-06-24T07:28:42.000Z"
  },
  {
    "videoId": "esif7dU0FCI",
    "title": "Служіння 23 червня 2024 року",
    "duration": 5855,
    "year": 2024,
    "formattedDate": "24 червня 2024 року",
    "rawDate": "2024-06-24T07:25:36.000Z"
  },
  {
    "videoId": "jM5_ISd_tzA",
    "title": "Прославлення Господа 23 червня 2024 року",
    "duration": 1454,
    "year": 2024,
    "formattedDate": "23 червня 2024 року",
    "rawDate": "2024-06-23T20:21:45.000Z"
  },
  {
    "videoId": "CmJp5RrSWUo",
    "title": "Прославлення Господа 16 червня 2024 року",
    "duration": 1232,
    "year": 2024,
    "formattedDate": "20 червня 2024 року",
    "rawDate": "2024-06-20T07:17:08.000Z"
  },
  {
    "videoId": "IolVHvHYawg",
    "title": "Служіння 16 червня 2024 року",
    "duration": 5558,
    "year": 2024,
    "formattedDate": "18 червня 2024 року",
    "rawDate": "2024-06-18T10:02:31.000Z"
  },
  {
    "videoId": "u-31hXnn_HY",
    "title": "\"Учебник по анатомии души\" (Псалом 31).  Андрей Парфило, 16.06.2024",
    "duration": 2304,
    "year": 2024,
    "formattedDate": "17 червня 2024 року",
    "rawDate": "2024-06-17T06:31:13.000Z"
  },
  {
    "videoId": "q4yOeJSSC-I",
    "title": "\"Два джерела мудрості\" (Якова 3:13-4:3). Віталій Зінченко,16.06.2024",
    "duration": 1896,
    "year": 2024,
    "formattedDate": "17 червня 2024 року",
    "rawDate": "2024-06-16T21:33:22.000Z"
  },
  {
    "videoId": "fwrvCuuNm7I",
    "title": "Прославлення Господа 9 червня 2024 року",
    "duration": 1967,
    "year": 2024,
    "formattedDate": "10 червня 2024 року",
    "rawDate": "2024-06-10T11:31:44.000Z"
  },
  {
    "videoId": "RfBmceNlCZ8",
    "title": "\"Задумане Господом буде виконано\" (Єремії 27:5-7). Микола Марйоха, 09.06.2024",
    "duration": 2221,
    "year": 2024,
    "formattedDate": "10 червня 2024 року",
    "rawDate": "2024-06-10T11:30:06.000Z"
  },
  {
    "videoId": "OiHwIXagUAI",
    "title": "Служіння хору 9 червня 2024 року",
    "duration": 579,
    "year": 2024,
    "formattedDate": "10 червня 2024 року",
    "rawDate": "2024-06-10T10:50:42.000Z"
  },
  {
    "videoId": "G6asKOaXQ48",
    "title": "\"Причини для спокою\" (Псалом 93). Андрій Міщенко, 09.06.2024",
    "duration": 1121,
    "year": 2024,
    "formattedDate": "10 червня 2024 року",
    "rawDate": "2024-06-10T10:45:42.000Z"
  },
  {
    "videoId": "5OOA74B9Hmg",
    "title": "Служіння 9 червня 2024 року",
    "duration": 6407,
    "year": 2024,
    "formattedDate": "10 червня 2024 року",
    "rawDate": "2024-06-10T07:46:31.000Z"
  },
  {
    "videoId": "IdCXCPm-9_w",
    "title": "\"Вірю я, Господи\". Служіння хору, 02.06.2024",
    "duration": 257,
    "year": 2024,
    "formattedDate": "05 червня 2024 року",
    "rawDate": "2024-06-04T21:25:21.000Z"
  },
  {
    "videoId": "sFMKHOQGWY4",
    "title": "Прославлення Господа 2 червня 2024 року",
    "duration": 1682,
    "year": 2024,
    "formattedDate": "03 червня 2024 року",
    "rawDate": "2024-06-03T14:45:55.000Z"
  },
  {
    "videoId": "rdJ81aN8tBY",
    "title": "\"Гордость и смирение\" (Иакова 4:6). Сергей Комисар, 02.06.2024",
    "duration": 2771,
    "year": 2024,
    "formattedDate": "03 червня 2024 року",
    "rawDate": "2024-06-03T13:38:09.000Z"
  },
  {
    "videoId": "jc9S05gsRa8",
    "title": "Служіння хору 2 червня 2024 року",
    "duration": 887,
    "year": 2024,
    "formattedDate": "03 червня 2024 року",
    "rawDate": "2024-06-03T13:28:13.000Z"
  },
  {
    "videoId": "bM1d0FMUl48",
    "title": "\"Приниження Господа - спасіння для нас\" (Ісаї 53:1-5). Микола Марйоха, 02.06.2024",
    "duration": 1273,
    "year": 2024,
    "formattedDate": "03 червня 2024 року",
    "rawDate": "2024-06-03T12:05:27.000Z"
  },
  {
    "videoId": "VKwqzta8aos",
    "title": "Служіння 02 червня 2024 року",
    "duration": 7434,
    "year": 2024,
    "formattedDate": "03 червня 2024 року",
    "rawDate": "2024-06-03T08:01:22.000Z"
  },
  {
    "videoId": "yI5dhjKNSwc",
    "title": "Прославлення Господа 26 травня 2024 року",
    "duration": 1730,
    "year": 2024,
    "formattedDate": "27 травня 2024 року",
    "rawDate": "2024-05-27T03:45:05.000Z"
  },
  {
    "videoId": "F9e7URZKlXg",
    "title": "Служіння хору 26 травня 2024 року",
    "duration": 571,
    "year": 2024,
    "formattedDate": "27 травня 2024 року",
    "rawDate": "2024-05-27T03:42:50.000Z"
  },
  {
    "videoId": "RlOqimgY42o",
    "title": "\"Перемагати зберігаючи віру\" (Об'явлення 2:1-7). Сергій Мазур, 26.05.2024",
    "duration": 2039,
    "year": 2024,
    "formattedDate": "27 травня 2024 року",
    "rawDate": "2024-05-26T21:27:08.000Z"
  },
  {
    "videoId": "T_UqRZQ4XmU",
    "title": "\"Тягар перемін\" (1 Самуїла 7:2). Віталій Зінченко, 26.05.2024",
    "duration": 1731,
    "year": 2024,
    "formattedDate": "26 травня 2024 року",
    "rawDate": "2024-05-26T20:59:55.000Z"
  },
  {
    "videoId": "qM-H-uZZ8Dc",
    "title": "Служіння 26 травня 2024 року",
    "duration": 6606,
    "year": 2024,
